no;title;author;journal;number;cites;year;cid;pubid;id
1251;PENINGKATAN AKTIVITAS BELAJAR AKUNTANSI SISWA KELAS X-KU 3 MELALUI PENERAPAN MODEL PMBELAJARAN KOOPERATIF TIPE COURSE REVIEW HORAY DI SMK NEGERI 1 BOYOLANGU TAHUN PELAJARAN …;D Wahyuni;SKRIPSI Jurusan Akutansi-Fakultas Ekonomi UM;;0;2017;#N/A;aKo_o5XvxeMC;xmJJ9Y0AAAAJ
1252;Pengaruh likuiditas dan struktur modal terhadap rentabilitas modal sendiri pada PT Astra Agro Lestari Tbk;S Wahyuni;UIN Sunan Gunung Djati Bandung;;0;2017;#N/A;lVu93_cgYy4C;xmJJ9Y0AAAAJ
1253;ADJEKTIVA KATEGORI ELATIVUS: PEMERKAYA KOSAKATA BAHASA JAWA;S Wahyuni;Kandai;11 (2), 151-160;0;2017;#N/A;xggF7591RyAC;xmJJ9Y0AAAAJ
1254;Studi Populasi Owa Jawa (Hylobates moloch) di Lereng Gunung Slamet Jawa Tengah;S Wahyuni, EK Nasution;Majalah Ilmiah Biologi BIOSFERA: A Scientific Journal;33 (1), 46-51;0;2017;#N/A;TPlbvKeUp3cC;xmJJ9Y0AAAAJ
1255;Alang dan Dedap Durhaka: Kajian Intertekstual;S Wahyuni;Jurnal Online Mahasiswa (JOM) Bidang Keguruan dan Ilmu Pendidikan;4 (2), 1-13;0;2017;#N/A;qVBRRHSSJ04C;xmJJ9Y0AAAAJ
1256;ANALISIS KUALITAS PRODUK DAN BRAND IMAGE SERTA LIFE STYLE TERHADAP KEPUTUSAN PEMBELIAN PRODUK J. REP DI KOTA SAMARINDA;D AMARATANI, S HUDAYAH, SRI WAHYUNI;Jurnal Ilmu Manajemen Mulawarman (JIMM);1 (2);0;2017;#N/A;lAj_JhtUatoC;xmJJ9Y0AAAAJ
1257;Minyak Atsiri untuk Konservasi Cagar Budaya Berbahan Batu Tahap II;S Wahyuni, WDP Rini, B Kasatriyanto, AW Purwoko, B Rachmat;Jurnal Konservasi Cagar Budaya Borobudur;11 (1), 29-39;0;2017;#N/A;cnT3a81PI4sC;xmJJ9Y0AAAAJ
1258;Indonesian Essential As Biocidesin Traditional-Based Artefact Consertvationstudy;N Cahyandaru, S Wahyuni, YAH Purnama;Jurnal Konservasi Cagar Budaya Borobudur;11 (1), 22-28;0;2017;#N/A;kAoMiUvgv_QC;xmJJ9Y0AAAAJ
1259;FAKTOR-FAKTOR YANG BERHUBUNGAN DENGAN ASMA BRONCIAL PADA ANAK DI RUANG SAKURA RUMAH SAKIT PTPN II BANGKATAN BINJAI TAHUN 2017;S Wahyuni;Jurnal Riset Hesti Medan Akper Kesdam I/BB Medan;2 (1), 66-70;0;2017;#N/A;w2v21TepJGQC;xmJJ9Y0AAAAJ
1260;FORMULATION OF CHITOSAN MEMBRANE COMPOSITION AND STIRRING OPTIMIZATION FOR REDUCING TOTAL SOLID OF PALM OIL MILL EFFLUENT;S Wahyuni, S Siswanto, SM Putra;Widyariset;3 (1), 35-46;0;2017;#N/A;Es-9c2L5hKwC;xmJJ9Y0AAAAJ
1261;Efektifitas Buah Semangka dan Jambu Biji Terhadap Nilai (OHIS) Pada Anak Usia 10-12 Tahun;LE PRASETYOWATI, SRI WAHYUNI;Jurnal Analis Kesehatan;5 (1), 483-489;0;2017;#N/A;rv71eUSj1K8C;xmJJ9Y0AAAAJ
1262;The Development Of Collision Module Based On Process Image For Physics Learning In Senior High School;FL Mi’rojiyah, S Sutarto, IK Mahardika, I Indrawati, J Prihatin;Pancaran Pendidikan;6 (2);0;2017;#N/A;Z610oKUqOA4C;xmJJ9Y0AAAAJ
1263;Peningkatkan Kemampuan Berpikir Kritis Pada Pokok Bahasan Ekosistem di SMA Negeri I Sumberpucung;RE Susetyarini, A Rofieq, R Latifa, S Wahyuni;JINoP (Jurnal Inovasi Pembelajaran);3 (1), 542-549;0;2017;#N/A;Fd6TstiuZzAC;xmJJ9Y0AAAAJ
1264;PERAN LABORATORIUM PEMASARAN DALAM MENUNJANG KESIAPAN SISWA MELAKSANAKAN PRAKTIK KERJA LAPANGAN;A Sari, S Wahyuni, L Noviani;Jurnal Pendidikan Bisnis dan Ekonomi;3 (1);0;2017;#N/A;LYSM3I27WpsC;xmJJ9Y0AAAAJ
1265;EFEK SEDUHAN KELOPAK KERING BUNGA ROSELLA (Hibiscus sabdariffa Linn) TERHADAP PENURUNAN KADAR KOLESTEROL PADA MENCIT PUTIH JANTAN Balb/C HIPERKOLESTEROL;S Wahyuni;Jurnal Wiyata Penelitian Sains dan Kesehatan;2 (2), 120-126;0;2017;#N/A;MDBbo4b0KHEC;xmJJ9Y0AAAAJ
1266;STUDI EKSPLORASI PADA WANITA PEKERJA SEKS;T Rahayu, S Wahyuni;Jurnal Perawat Indonesia;1 (1), 11-17;0;2017;#N/A;9PbDelcLwNgC;xmJJ9Y0AAAAJ
1267;PEMBERIAN PUPUK ORGANIK CAIR LIMBAH JERAMI PADI DAN LIMBAH CANGKANG TELUR AYAM UNTUK MENINGKATKAN KANDUNGAN KALSIUM TANAMAN SAWI (Brassica juncea, L.);SET Wahyuni, A Asngad;Muhammadiyah University Press;;0;2017;#N/A;LYW2S8xaXYEC;xmJJ9Y0AAAAJ
1268;Intake of Moringa oleifera Leaf Extract Decreases IL-1 and TNF-α Levels in Dyslipidemic Wistar Rat Model;S Wahyuni, IWPS Yasa;Recent Advances in Biology and Medicine;3 (2017), 1720;0;2017;#N/A;2VmNxfDIOWgC;xmJJ9Y0AAAAJ
1269;PERBANDINGAN UNSUR INTRINSIK DUA CERPEN YANG TERKANDUNG DALAM KUMPULAN CERPEN PERASAAN IBU KARYA K. USMAN;S Wahyuni;JURNAL BASTRA;3 (3);0;2017;#N/A;HNqp4bORoCIC;xmJJ9Y0AAAAJ
1270;PENGARUH LOAN TO DEPOSIT RATIO (LDR), CAPITAL ADEQUACY RATIO (CAR) DAN RASIO BEBAN OPERASIONAL PENDAPATAN OPERASIONAL (BOPO) TERHADAP RETURN ON ASSETS (ROA) PADA PERBANKAN YANG …;SF Wahyuni;JURNAL AGRICA;9 (1), 29-37;0;2017;#N/A;7XCffrwrS2sC;xmJJ9Y0AAAAJ
1271;HUBUNGAN ANTARA KEPUASAN KERJA DENGAN KINERJA PADA KARYAWAN WAROENG GROUP CABANG YOGYAKARTA;S Wahyuni;Universitas Mercu Buana Yogyakarta;;0;2017;#N/A;H8BRrGBkN7cC;xmJJ9Y0AAAAJ
1272;PENDIDIKAN PEMAKAI DI PERPUSTAKAAN: Perencanaan Program Pendidikan Pemakai Bagi Mahasiswa Baru STMIK AKAKOM Yogyakarta;S Wahyuni;;;0;2017;#N/A;in81wS_EFI4C;xmJJ9Y0AAAAJ
1273;SEJARAH PERADABAN ISLAM ABAD PERTENGAHAN DI INDONESIA “Sultan Malik Al–Shaleh”;Y Poncowati, D Salihah, S Wahyuni, J Nisak, M Budiman;Agama Islam;;0;2017;#N/A;dhZ1Wuf5EGsC;xmJJ9Y0AAAAJ
1274;THE IMPACT OF HONEY ON CHANGE IN NUTRITIONAL STATUS IN CHILDREN WITH POOR NUTRITION;H Harmiyati, A Soejoenoes, S Wahyuni, K Aristiati, S Hadisaputro;Belitung Nursing Journal;3 (2), 110-119;0;2017;#N/A;BZGggv0hN9sC;xmJJ9Y0AAAAJ
1275;STUDI KUALITATIF PERILAKU PENGGUNA JASA PPOB KORSIS E-PAYMENT;S Wahyuni, D Amboningtyas;Journal of Management;3 (3);0;2017;#N/A;Itmi1h0dExoC;xmJJ9Y0AAAAJ
1276;On generalization of Schur’s Lemma for group representation on module over PIDs;S WAHYUNI;Moulay Ismaıl University Faculty of Sciences and Technology of Errachidia …;;0;2017;#N/A;A1VvXmYcXXgC;xmJJ9Y0AAAAJ
1277;UPAYA MENINGKATKAN PRESTASI BELAJAR MATEMATIKA DENGAN MENGGUNAKAN PEMBELAJARAN KOOPERATIF TIPE JIGSAW;S Wahyuni;JP;P2M (Jurnal Pendidikan dan Pembelajaran Matematika) 2 (1), 95-104;0;2017;#N/A;I__7AI8a974C;xmJJ9Y0AAAAJ
1278;PERBANDINGAN PENGUASAAN KONSEP ANTARA SISWA YANG BELAJAR MENGGUNAKAN DISCOVERY LEARNING DENGAN GUIDED INQUIRI PADA MATERI SISTEM ORGANISASI KEHIDUPAN DI KELAS VII MTS IT AL …;S Wahyuni, U Hasanah;Bio-Lectura;4 (1);0;2017;#N/A;1GSnt3Xtl_sC;xmJJ9Y0AAAAJ
1279;PERANCANGAN SISTEM INVENTARISASI DAN PENDETEKSIAN KESAMAAN JUDUL TUGAS AKHIR PERGURUAN TINGGI;S Wahyuni, YS Purwaningsih, E Syahnaz;UNES Journal Of Information System;1 (2), 129-139;0;2017;#N/A;lf0D1wPZyaoC;xmJJ9Y0AAAAJ
1280;Influence Education Training and Work Environment on Performance Through Employee Job Satisfaction Sukoharjo district Puskesmas Weru;S Wahyuni;eAbstract Excellent;3 (1);0;2017;#N/A;1AS7WB7zg6gC;xmJJ9Y0AAAAJ
1281;PENGEMBANGAN MODEL PEMBELAJARAN GERAK DASAR LEMPAR TURBO BERBASIS PERMAINAN UNTUK SISWA KELAS V SEKOLAH DASAR;SRI WAHYUNI;University of Muhammadiyah Malang;;0;2017;#N/A;WMsFzbFqK_QC;xmJJ9Y0AAAAJ
1282;“What Happen Next?” Strategy to Improve Students Skill on Writing Narrative Text;S Wahyuni;VELES Voices of English Language Education Society;1 (1);0;2017;#N/A;MreiaWo1ERkC;xmJJ9Y0AAAAJ
1283;KOMUNIKASI PEMASARAN USAHA KULINER DI KOTA PEKANBARU;PL Oktri;Universitas Andalas;;0;2017;#N/A;o-PowTg_VKEC;xmJJ9Y0AAAAJ
1284;Sistem Pendukung Keputusan Pembiayaan Mitra Madani Metode Analytycal Hierarchy Process (AHP) Pt. BPR Syariah Artha Madani Bekasi;S Wahyuni, AN Nuraeni;Jurnal Informatika SIMANTIK;2 (1), 32-37;0;2017;#N/A;HygtOXotxAUC;xmJJ9Y0AAAAJ
1285;GAMBARAN PENGETAHUAN IBU HAMIL TENTANG HUBUNGAN SEKSUAL SELAMA KEHAMILAN;S Wahyuni, K Ramli;Jurnal Ilmiah Pena: Sains dan Ilmu Pendidikan;8 (1), 17-23;0;2017;#N/A;A5aiAONn640C;xmJJ9Y0AAAAJ
1286;HUBUNGAN PENGETAHUAN DAN SIKAP DENGAN PERILAKU PENCEGAHAN INFEKSI LEPTOSPIROSIS PADA IBU HAMIL;IN Hasanah, S Wahyuni;JURNAL KEBIDANAN;6 (12), 55-62;0;2017;#N/A;l2sC-qQILUoC;xmJJ9Y0AAAAJ
1287;Peningkatan Prestasi Belajar Mahasiswa Melalui Penerapan Model Pembelajaran Kooperatif Tipe Stad (Student Teams Achievement Divission) Pada Mata Kuliah Studi Kelayakan Bisnis;SF Wahyuni;Jurnal Ilmiah Manajemen dan Bisnis;18 (1), 89-100;0;2017;#N/A;DxlTmyU89zoC;xmJJ9Y0AAAAJ
1288;SELF-REGULATED LEARNING DAN PROKRASTINASI: STUDI PADA SISWA SMK PANCA KARYA TANGERANG;N Zain, SS Wahyuni;Jurnal Pendidikan Ekonomi dan Bisnis (JPEB);3 (2), 32-43;0;2017;#N/A;CREiCvMVTUAC;xmJJ9Y0AAAAJ
1289;Pendidikan untuk Anak dalam Serat Bratasunu;A Pramudiyanto, S Wahyuni;Muhammadiyah University Press;;0;2017;#N/A;MdMr--dQ_pMC;xmJJ9Y0AAAAJ
1290;Optimalisasi Budaya Literasi melalui Program Journaling-Feedback;S Wahyuni, A Pramudiyanto;Muhammadiyah University Press;;0;2017;#N/A;pQthLKZIaNQC;xmJJ9Y0AAAAJ
1291;APLIKASI MEMBRAN KITOSAN DARI CANGKANG UDANG WINDU (Penaeus monodon) UNTUK MEMPERPANJANG MASA SIMPAN SARI BUAH JERUK MANIS (Citrus sinensis);S Wahyuni;Jurnal Sains dan Teknologi Pangan;2 (1);0;2017;#N/A;FGHlONkF9GcC;xmJJ9Y0AAAAJ
1292;HUBUNGAN DUKUNGAN SOSIAL SUAMI TERHADAP POLA PANTANG MAKAN IBU NIFAS DI WILAYAH KERJA PUSKESMAS KARANGDOWO KLATEN;S Wahyuni;INVOLUSI Jurnal Ilmu Kebidanan (Journal of Midwifery Science);7 (13);0;2017;#N/A;JVJ6OkSwpHsC;xmJJ9Y0AAAAJ
1293;PERBEDAAN PERAWATAN DENGAN KASA STERIL DAN POVIDONE IODINE 10% TERHADAP LAMA LEPAS TALI PUSAT PADA BAYI DI WILAYAH PUSKESMAS KARANGANOM KABUPATEN KLATEN;E Wahyuningsih, S Wahyuni;MOTORIK Jurnal Ilmu Kesehatan (Journal Of Health Science);12 (24);0;2017;#N/A;UO8fSLLLPykC;xmJJ9Y0AAAAJ
1294;Pengaruh Pemberian Kombinasi Pakan Fermentasi dengan Multi Enzim dan Vitamin E dalam Ransum terhadap Peningkatan Kualitas Semen Ayam Arab;M Mustafa, D Dasrul, MA Yaman, S Wahyuni, M Sabri;Jurnal Agripet;17 (1), 43-52;0;2017;#N/A;b2v3RnpdjZkC;xmJJ9Y0AAAAJ
1295;Literasi Informasi: Penelusuran Informasi, Plagiarisme, Sitasi Dan Reference;S Wahyuni;Perpustakaan STMIK AKAKOM;;0;2017;#N/A;PFhWnMnuT1QC;xmJJ9Y0AAAAJ
1296;Hubungan Jaringan Komunikasi dan Dinamika Kelompok dengan Kapasitas Petani dalam Agribisnis Padi Organik di Jawa Barat;S Wahyuni, S Sumardjo, DP Lubis, D Sadono;Jurnal Penyuluhan;13 (1), 110-120;0;2017;#N/A;dY-VugTTHzcC;xmJJ9Y0AAAAJ
1297;Perkawinan Beda Agama di Indonesia dan Hak Asasi Manusia;S Wahyuni;IN RIGHT: Jurnal Agama dan Hak Azazi Manusia;1 (1);0;2017;#N/A;kiFE3DPpsncC;xmJJ9Y0AAAAJ
1298;METODE PEMBENTUKAN KARAKTER ISLAMI (STUDI KASUS SDIT ADZKIA PADANG);S Wahyuni;Pendidikan Islam;1 (1), 54-71;0;2017;#N/A;Zo6E4E6iJKMC;xmJJ9Y0AAAAJ
1299;ANALISIS KESULITAN DAN HASIL BELAJAR MENGGAMBAR POLA CELANA PANJANG SISWA KELAS XI TATA BUSANA SMK NEGERI 3 TEBING TINGGI;S Wahyuni;UNIMED;;0;2017;#N/A;GjXqcohcbckC;xmJJ9Y0AAAAJ
1300;"SKKD No. 410/UN25. 5.1/TU. 3/2017"" Pengembangan Bahan Ajar Kopi pada Mata Pelajaran IPA untuk Meningkatkan Keterampilan Berpikir Kritis Siswa SMP Daerah Perkebunan Kopi.""";S Wahyuni;;;0;2017;#N/A;-TLX1-BxFiYC;xmJJ9Y0AAAAJ
1301;"SKKD No. 359/UN25. 5.1/TU. 3/2017"" Penelusuran Banjir untuk Optimasi Waduk Sampean Baru Kabupaten Bondowoso Lanjutan Tahun Kedua.""";WY Widiarti, DIE Hidayah, S Wahyuni;;;0;2017;#N/A;rlwtDmSc194C;xmJJ9Y0AAAAJ
1302;PENINGKATAN PRESTASI BELAJAR SISWA DENGAN MENERAPKAN MODEL STAD PADA MATA PELAJARAN PKn MATERI POLITIK LUAR NEGERI INDONESIA YANG BEBAS AKTIF KELAS VI SDN 2 BENDOAGUNG …;S Wahyuni;Jurnal Pendidikan PROFESIONAL;5 (3);0;2017;#N/A;23Hg5vt_rPQC;xmJJ9Y0AAAAJ
1303;PERLINDUNGAN TERHADAP KARYA DESAIN KOMUNIKASI VISUAL (DKV) DI KOTA SEMARANG BERDASARKAN UNDANG-UNDANG NOMOR 28 TAHUN 2014 TENTANG HAK CIPTA;D OH, SRI WAHYUNI, S Budi;Fakultas Hukum UNDIP;;0;2017;#N/A;L2DjCdFNi3gC;xmJJ9Y0AAAAJ
1304;"SKKD NO. 232/UN25. 5.1/TU. 3/2017"" Strategi Pemenuhan Kebutuhan Keluarga Pensiunan yang Menjadi Nasabah di Bank Tabungan Pensiunan Nasional (BTPN) Banyuwangi.""";DN Purwandari, DS Wahyuni;;;0;2017;#N/A;D_25heFg6JwC;xmJJ9Y0AAAAJ
1305;Kepermanenan Arus Kas dan Ekspektasi Pasar dalam Penentuan Pembayaran Dividen Meningkat;S Wahyuni;Riset Akuntansi dan Keuangan Indonesia;6 (2), 151-162;0;2017;#N/A;AE81f6nWjdQC;xmJJ9Y0AAAAJ
1306;"SKKD No. 321/UN25. 5.1/TU. 3/2017"" Identifikasi Potensi Lokasi Sumur Resapan sebagai Imbuhan AlamiAir Tanah di Kawasan Perkotaan Jember""";S Wahyuni, DG Halik, WY Widiarti;;;0;2017;#N/A;LwieBGrN4GEC;xmJJ9Y0AAAAJ
1307;"SKKD No. 320/UN25. 5.1/TU. 3/2017"" Karakteristik Mineral Sedimen di Waduk Wlingi dan Implikasinya terhadap Efisien Penggelontoran Sendimen""";D Sisinggih, S Wahyuni, F Hidatyat;;;0;2017;#N/A;6jAoOr-ogVAC;xmJJ9Y0AAAAJ
1308;Perkembangan Pendidikan di Negara Jepang Pasca Perang Dunia II dan Relevansinya sebagai Pendalaman Materi Sejarah di Sekolah Menengah Atas;SRI WAHYUNI;Universitas Sebelas Maret;;0;2017;#N/A;zBCjByih94YC;xmJJ9Y0AAAAJ
1309;Analisis Swot Tataniaga Sayuran Dataran Tinggi Berbasis Kelembagaan Sub Terminal Agribisnis (Sta);P Pujiharto, S Wahyuni;Agritech: Jurnal Fakultas Pertanian Universitas Muhammadiyah Purwokerto;17 …;0;2017;#N/A;8QO3eJiZnkEC;xmJJ9Y0AAAAJ
1310;COMPARISON TRANSCUTANEOUS ELECTRICAL NERVE STIMULATION KINESIO TAPING AND DECREASING TO SCALE BACK PAIN IN PREGNANT WOMEN UNDER THIRD TRIMESTER IN PUBLIC HEALTH DISTRICT …;S Wahyuni, L Hartati, NP Dewi, J Sari;Proceedings of the International Conference on Applied Science and Health …;;0;2017;#N/A;dQJM2trw0wsC;xmJJ9Y0AAAAJ
1311;PENGARUH DIFERENSIASI PRODUK DAN PERSEPSI KUALITAS PRODUK SERTA PROMOSI TERHADAP KEPUTUSAN PEMBELIAN TAHU JONTOR DI SAMARINDA;A KAHFIADI, SRI WAHYUNI;Jurnal Ilmu Manajemen Mulawarman (JIMM);1 (4);0;2017;#N/A;FmXltp8y-ZkC;xmJJ9Y0AAAAJ
1312;PENGARUH PEMBERIAN SALEP FITOPLANKTON Chlorella vulgaris TERHADAP PENYEMBUHAN LUKA SAYAT (Incisi) PADA MENCIT (Mus musculus albinus);SRI WAHYUNI;;;0;2017;#N/A;kFM4V80Y5EsC;xmJJ9Y0AAAAJ
1313;The use of chitosan of Pomacea canaliculata shell as natural preservation to maintain fruit quality during storage process: Used as audio visual media of biotechnology learning;YF Trisnaningrum, S Wahyuni, A Rofieq;Jurnal Pendidikan Biologi Indonesia;2 (3), 237-247;0;2017;#N/A;lLPirIASiZEC;xmJJ9Y0AAAAJ
1314;Pollen ultrastructure of genus Dendrobium orchids as a learning resource;LD Apriani, E Susetyarini, S Wahyuni;Jurnal Pendidikan Biologi Indonesia;2 (3), 248-257;0;2017;#N/A;SrsqWtBqNIQC;xmJJ9Y0AAAAJ
1315;ANALISIS KOHESI DALAM KARANGAN SISWA KELAS VIII SMP MUHAMMADIYAH TAKKALASI KABUPATEN BARRU;I Iskandar, S Wahyuni;KONFIKS: JURNAL BAHASA DAN SASTRA INDONESIA;2 (1), 57-68;0;2017;#N/A;8s22W2WWFy4C;xmJJ9Y0AAAAJ
1316;The effectivity of Health Media Promotion (Leaflet) in Society’s Knowledge about Gastritis in Palopo Indonesia;N Uly, S Wahyuni, IW Yuliarsa;PROCEEDING;1 (1);0;2017;#N/A;_IwLajd9sWMC;xmJJ9Y0AAAAJ
1317;The effectiveness range of motion (ROM) exercise to the ankle brachial index on patient with diabetic foot ulcer in Indonesia;S Wahyuni;PROCEEDING;1 (1);0;2017;#N/A;7f0ks1Axv_QC;xmJJ9Y0AAAAJ
1318;Love And Hope Reflected In Gayle Forman’s If I Stay Novel (2009): An Individual Psychological Approach;S Wahyuni, T Setyabudi, SS Titis Setyabudi, M Hum;Universitas Muhammadiyah Surakarta;;0;2017;#N/A;r5WMYYrv30cC;xmJJ9Y0AAAAJ
1319;Panduan Unggah Mandiri Karya Ilmiah Bagi Mahasiswa STMIK AKAKOM Yogyakarta Edisi Revisi Pertama;S Wahyuni;STMIK AKAKOM Yogyakarta;;0;2017;#N/A;dw5aoL0HVgwC;xmJJ9Y0AAAAJ
1320;PENERAPAN STUDENT TEAMS ACHIEVEMENT DIVISION DISERTAI MEDIA GAMBAR UNTUK MENINGKATKAN HASIL BELAJAR SISWA PEMASARAN;H Nurdina, S Joyoatmojo, S Wahyuni;Jurnal Pendidikan Bisnis dan Ekonomi;2 (2);0;2017;#N/A;lYbyOjaXH8MC;xmJJ9Y0AAAAJ
1321;Faktor–Faktor yang Mempengaruhi Keikutsertaan Bidan Praktik Mandiri pada Program Jaminan Kesehatan Nasional di Kota Palangka Raya;R Riyanti, S Wahyuni;Jurnal Surya Medika (JSM);2 (2), 1-12;0;2017;#N/A;0kxB6oEY0CcC;xmJJ9Y0AAAAJ
1322;ON GRADED N-PRIME SUBMODULE OF A GRADED FRACTION MODULE;IE Wijayanti, S Wahyuni;Far East Journal of Mathematical Sciences;101 (3), 559;0;2017;#N/A;A7-hzOuI2KQC;xmJJ9Y0AAAAJ
1323;Persyaratan Untuk Mendapatkan Surat Bukti Pengumpulan Karya Ilmiah Edisi Terbaru;D Librado, S Wahyuni;STMIK AKAKOM;;0;2017;#N/A;UEFpDhwOD2kC;xmJJ9Y0AAAAJ
1324;Pengembangan Lembar Kegiatan Siswa Fisika Berbasis Model Empirical Inductive Learning Cycle Di SMA;H Marlistya, AD Lesmono, S Wahyuni, M Maryani;JURNAL PEMBELAJARAN FISIKA;5 (2), 177-181;0;2017;#N/A;OtrppQHxQ5wC;xmJJ9Y0AAAAJ
1325;FAKTOR-FAKTOR YANG BERHUBUNGAN DENGAN KEJADIAN GAGAL GINJAL TERMINAL PADA PENDERITA DIABETES MELLITUS TIPE 2 DI RSUD. DR. SOEDARSO DAN RSU. YARSI PONTIANAK;S Wahyuni, I Saleh, I Budiastutik;Jumantik;3 (1);0;2017;#N/A;Et1yZiPVzsMC;xmJJ9Y0AAAAJ
1326;Faktor-Faktor Yang Berhubungan Dengan Kunjungan Pelayanan Gigi Di Puskesmas Way Laga Kota Bandar Lampung;A Yosa, S Wahyuni;Jurnal Analis Kesehatan;4 (2), 420-426;0;2017;#N/A;mCmIWee0OMYC;xmJJ9Y0AAAAJ
1327;Rancang Bangun Sistem Telemetri Pengukuran Suhu dan Kelembaban Udara Menggunakan Sensor SHT11 dengan Memanfaatkan RF APC220;S Wahyuni, GA Pauzi, W Warsito;Jurnal Teori dan Aplikasi Fisika;4 (2);0;2017;#N/A;XzWLPxS1ir4C;xmJJ9Y0AAAAJ
1328;"SKKD NO. 031/UN25. 5.1/TU. 3/2016."" PENGARUH PERILAKU PEMIMPIN TERHADAP UPAYA PEMBERDAYAAN KARYAWAN (SUATU KAJIAN TERHADAP PENGURUS KOPERASI PEGAWAI REPUBLIK INDONESIA (KPRI …";S Wahyuni;;;0;2017;#N/A;WTkkuPxyGkUC;xmJJ9Y0AAAAJ
1329;PENGARUH PERILAKU PEMIMPIN TERHADAP UPAYA PEMBERDAYAAN KARYAWAN (Suatu Kajian Terhadap Pengurus Koperasi Pegawai Republik Indonesia (KPRI) Kabupaten Jember);S Wahyuni;JURNAL PENDIDIKAN EKONOMI: Jurnal Ilmiah Ilmu Pendidikan, Ilmu Ekonomi dan …;;0;2017;#N/A;MIUEjqm7qCUC;xmJJ9Y0AAAAJ
1330;PENGARUH CUSTOMER SERVICE STRATEGIES TERHADAP AMAZING CUSTOMER EXPERIENCES MAHASISWA PROGRAM STUDI PENDIDIKAN EKONOMI;MS Muntasir, S Wahyuni, SA Totalia;Jurnal Pendidikan Bisnis dan Ekonomi;2 (2);0;2017;#N/A;dYRx7efp7U0C;xmJJ9Y0AAAAJ
1331;Mensikapi Kehadiran Facebook: Dampak Positif Dan Negatif Bagi Masyarakat;S Wahyuni;STMIK AKAKOM Yogyakarta;;0;2017;#N/A;zDhyt2jClVkC;xmJJ9Y0AAAAJ
1332;Persepsi Siswa Terhadap Penggunaan Media Pembelajaran Fisika Di SMA Negeri Se-kota Banda Aceh;S Wahyuni, AR Marwan;Jurnal Ilmiah Mahasiswa Pendidikan Fisika;2 (1), 135-140;0;2017;#N/A;QC-2xSqExF4C;xmJJ9Y0AAAAJ
1333;Pengaruh Pupuk Organik Cair Limbah Jerami Padi Dan Limbah Cangkang Telur Ayam Terhadap Kandungan Kalsium Dan Pertumbuhan Tanaman Sawi (Brassica juncea, L.);SET Wahyuni;Universitas Muhammadiyah Surakarta;;0;2017;#N/A;5MWWCdJses0C;xmJJ9Y0AAAAJ
1334;FAKTOR-FAKTOR YANG BERHUBUNGAN DENGAN KEJADIAN HIPERTENSI PADA LANSIA DI UPT PUSKESMAS CILEUNGSI KABUPATEN BOGOR TAHUN 2016;A Ulfa, D Wahyuni;Jurnal Ilmiah Kesehatan MH Thamrin;9 (1), 15-20;0;2017;#N/A;3u3nxgfnd-AC;xmJJ9Y0AAAAJ
1335;Perbandingan Gambaran Darah sebelum dan setelah Pemberian Propofol pada Babi dengan Metode Infus Gravimetri;S Wahyuni;Universitas Gadjah Mada;;0;2017;#N/A;spwacExez6wC;xmJJ9Y0AAAAJ
1336;Faktor-faktor Yang Mempengaruhi Metabolisme Tubuh;S Wahyuni;;;0;2017;#N/A;8p-ueveQw4wC;xmJJ9Y0AAAAJ
1337;Enzim, Koenzim dan Kofaktor;S Wahyuni;;;0;2017;#N/A;kmGFBRAO0EoC;xmJJ9Y0AAAAJ
1338;The Minangkabau local wisdom in numeral classifier for food ingredient counter case of Halaban isolect, Lima Puluh Kota district;S Wahyuni, N Nadra, R Febrina;;;0;2017;#N/A;Fx7lCCP36QIC;xmJJ9Y0AAAAJ
1339;DeskripsiKesulitanBelajarMatematikaSiswaDitinjaudariKetersediaandanPenggunaanFasilitasBelajar;S Wahyuni;UNIVERSITAS NEGERI MAKASSAR;;0;2017;#N/A;bf7w-NijnqMC;xmJJ9Y0AAAAJ
1340;Penatalaksanaan Fisioterapi pada Kasus Ischialgia Bilateral Et Causa Spondylolisthesis di RSUD Salatiga;R Mu'awanah, E Waspada, S Wahyuni, KS Dwi Rosella;Universitas Muhammadiyah Surakarta;;0;2017;#N/A;B4wWq2ztVNgC;xmJJ9Y0AAAAJ
1341;Pelaksanaan Peraturan Pemerintah Nomor 46 Tahun 2013 Tentang Pajak Penghasilan Atas Penghasilan dari Usaha yang Diterima Atau Diperoleh Wajib Pajak Sektor Usaha Mikro Kecil …;S Wahyuni;Universitas Sumatera Utara;;0;2017;#N/A;x9X1S-hd97YC;xmJJ9Y0AAAAJ
1342;Peningkatan Keaktifan dan Hasil Belajar IPA Melalui Model Pembelajaran Kooperatif Tipe Make a Match Berbantuan Media Gambar;S Wahyuni;Program Studi Pendidikan Guru Sekolah Dasar FKIP-UKSW;;0;2017;#N/A;UmJFWc0aipQC;xmJJ9Y0AAAAJ
1343;Development of Module Based on Local Potential Integrated SETS in Junior High School;T Prihandono, S Wahyuni, ZS Pamungkas;;;0;2017;#N/A;iomT83CKXisC;xmJJ9Y0AAAAJ
1344;METODE LANGSUNG KALKULUS VARIASI PADA MODEL THOMAS-FERMI DAN PERLUASANNYA;S WAHYUNI;Universitas Gadjah Mada;;0;2017;#N/A;6w2ZCmoKEM0C;xmJJ9Y0AAAAJ
1345;MESIN PEMBUAT MINUMAN OTOMATIS SEBAGAI PENGENDALI KOMPOSISI BAHAN DENGAN MENGGUNAKAN SOLENOID VALVE;SRI WAHYUNI;POLITEKNIK NEGERI SRIWIJAYA;;0;2017;#N/A;hImZayhCRfQC;xmJJ9Y0AAAAJ
1346;Studi Tentang Pelaksanaan Pemerintahan Desa Di Kecamatan Bontonompo Selatan Kabupaten Gowa;SRI WAHYUNI;UNIVERSITAS NEGERI MAKASSAR;;0;2017;#N/A;1zNUifcpCKoC;xmJJ9Y0AAAAJ
1347;Kemampuan Menulis Wacana Narasi Sugestif dalam Bahasa Bugis Siswa Kelas IX SMP Negeri 3 Ma’rang Kabupaten Pangkep;S Wahyuni;UNIVERSITAS NEGERI MAKASSAR;;0;2017;#N/A;fhMX52Pd6iQC;xmJJ9Y0AAAAJ
1348;Karakteristik Himpunan Potongan Dari Himpunan Fuzzy Bernilai Semilatis;HOL Monim, S Wahyuni, I Wijayanti;Universitas Gadjah Mada;;0;2017;#N/A;Z8CpXElfgm4C;xmJJ9Y0AAAAJ
1349;Pengaruh Ambulansi Dini terhadap Pemulihan Pasien Post Operasi Abdomen di RS. Kota Medan;S Wahyuni;;;0;2017;#N/A;nYc7v9NCwtsC;xmJJ9Y0AAAAJ
1350;ANALISIS INDIKATOR KINERJA (KPI) DALAM IMPLEMENTASI BALANCED SCORECARD (Studi Kasus pada PT Bank Syariah Mandiri Area Solo);SRI WAHYUNI, H Basuki;Universitas Gadjah Mada;;0;2017;#N/A;-jghkW3WqMUC;xmJJ9Y0AAAAJ
1351;PENERAPAN MODEL PEMBELAJARAN CURAH PENDAPAT UNTUK MENINGKATKAN MOTIVASI BELAJAR SISWA DI KELAS VIIA SMP NEGERI 6 CILACAP;S Wahyuni;Jurnal Ilmiah Guru Caraka Olah Pikir Edukatif;21 (1);0;2017;#N/A;54MofcL-yxcC;xmJJ9Y0AAAAJ
1352;Pengaruh Panjang Tungkai, Kelentukan dan Motivasi terhadap Kemampuan Lari 100 meter Siswa SMK Negeri 1 Somba Opu Kabupaten Gowa;S Wahyuni;Pascasarjana;;0;2017;#N/A;srBcWmd28BQC;xmJJ9Y0AAAAJ
1353;FAMILY’S EXPERIENCES IN TAKING CARE PATIENTS WITH HALLUCINATION;SE Wahyuni, ML Nst, W Daulay;Idea Nursing Journal;8 (3);0;2017;#N/A;4_XrlajHzhgC;xmJJ9Y0AAAAJ
1354;Komparasi Efektivitas Model Pembelajaran Aptitude Treatment Interaction (ATI) dan Model Pembelajaran Kooperatif Tipe Team Assisted Individualization (TAI) dengan Pendekatan …;SRI WAHYUNI;Pascasarjana;;0;2017;#N/A;_9EdYq_GCQ0C;xmJJ9Y0AAAAJ
1355;PENGARUH PENERAPAN MULTIMEDIA PEMBELAJARAN BERBASIS TIGA TINGKATAN REPRESENTASI KIMIA TERHADAP HASIL BELAJAR SISWA PADA MATERI KOLOID KELAS XI SMAN 5 MATARAM;SRI WAHYUNI;UPT. Perpustakaan;;0;2017;#N/A;RtDPZMhf-s8C;xmJJ9Y0AAAAJ
1356;STEROID LEVEL AND PREGNANCY RATE OF ACEH COWS IN RESPONSE TO OVULATION INDUCTION USING PRESYNCHOVSYNCH METHOD;M Adam, TN Siregar, S Wahyuni, G Gholib, CE Ramadhana, R Ananda, ...;Jurnal Kedokteran Hewan-Indonesian Journal of Veterinary Sciences;11 (4);0;2017;#N/A;-Ex_6Thn4vsC;xmJJ9Y0AAAAJ
1357;Kisi Difraksi dengan Menggunakan Batang Talas (Colocasia esculenta);S Wahyuni, A Prabawani;Unnes Physics Journal;6 (1), 74-77;0;2017;#N/A;T-SPRlcIgBMC;xmJJ9Y0AAAAJ
1358;Pengembangan Teknik Serologi untuk Deteksi Dini Penyakit Jamur Akar Putih (Rigidoporus Microporus) pada Tanaman Karet;CI Dalimunthe, R Tistama, S Wahyuni, HS Darwis;Indonesian Journal of Natural Rubber Research;35 (2), 129-138;0;2017;#N/A;9Gmr9OE0IYAC;xmJJ9Y0AAAAJ
1359;APLIKASI MATRIKS TRIDIAGONAL UNTUK PEDNYELESAIAN NILAI EIGEN SEBAGAI PENGETAHUAN GURU UNTUK PEMBELAJARAN MATEMATIKA;J MASIPUPU;Universitas Gadjah Mada;;0;2017;#N/A;RMVrO4bo-SsC;xmJJ9Y0AAAAJ
1360;STRATEGI BUDIDAYA PADI UNTUK MENDUKUNG KETAHANAN PANGAN DI LAHAN TADAH HUJAN DALAM MENGHADAPI PERUBAHAN IKLIM;R Kartikawati, E Yulianingsih, S Wahyuni, A Wihardjaka;Prosiding Seminar Nasional Fakultas Pertanian UNS;1 (1), 103-108;0;2017;#N/A;uDl620nrkPcC;xmJJ9Y0AAAAJ
1361;Kisi Difraksi dengan Menggunakan Batang Talas (Colocasia esculenta);A Prabawani, S Wahyuni;Journal of Creativity Student;2 (1), 1-18;0;2017;#N/A;3utUx_xxzcoC;xmJJ9Y0AAAAJ
1362;PENGARUH SERTIFIKAT BANK INDONESIA SYARIAH (SBIS), INDEKS HARGA SAHAM GABUNGAN (IHSG), DAN INFLASI TERHADAP NILAI AKTIVA BERSIH REKSADANA SYARIAH PERIODE JANUARI 2011-DESEMBER 2015;S WAHYUNI;Universitas Pamulang;;0;2017;#N/A;41b8sTJFDYwC;xmJJ9Y0AAAAJ
1363;Pengaruh Core Stability Exercise Dan William Flexion Exercise Terhadap Penurunan Nyeri Punggung Bawah (NPB) Miogenik Di Rsud Sunan Kalijaga Demak;S Wahyuni;Universitas Muhammadiyah Surakarta;;0;2017;#N/A;8Fucociq1QoC;xmJJ9Y0AAAAJ
1364;HUBUNGAN TINGKAT PENERAPAN PERATURAN, LINGKUNGAN DAN FASILITAS DENGAN KONDISI BELAJAR DI ASRAMA AKBID WIRA HUSADA NUSANTARA MALANG;A Budiarti, S Wahyuni;Biomed Science;5 (1), 1-6;0;2017;#N/A;L8oS6_awjPoC;xmJJ9Y0AAAAJ
1365;Penatalaksanaan Fisioterapi Pada Kondisi Calcaneus Spurs Dextra Di Rsud Dr. Moewardi Surakarta;S Wahyuni;Universitas Muhammadiyah Surakarta;;0;2017;#N/A;6lhY8CtEloYC;xmJJ9Y0AAAAJ
1366;Perbedaan Nilai VO2maks Pada Remaja Di Daerah Dataran Tinggi dan Daerah Dataran Rendah;I Adristian, S Wahyuni;Universitas Muhammadiyah Surakarta;;0;2017;#N/A;EwQYaEtUpKwC;xmJJ9Y0AAAAJ
1367;PENGARUH HASIL BELAJAR MAHASISWA MENGGUNAKAN MODEL PEMBELAJARAN BERBASIS MASALAH DI FKIP UMSU;I Maryanti, S Wahyuni, EM Panggabean;JURNAL MATHEMATIC PAEDAGOGIC;2 (1), 83-89;0;2017;#N/A;oEW5MyxtvQ4C;xmJJ9Y0AAAAJ
1368;Efektivitas Pelvic Rocking Exercises terhadap Lama Waktu Persalinan pada Ibu Primipara;KA Susiloretni, S Wahyuni;Jurnal Ilmiah Kesehatan (JIK);10 (2);0;2017;#N/A;AdUz3-SiDfgC;xmJJ9Y0AAAAJ
1369;TINDAK TUTUR WACANA RUBRIK POJOK “AMAQ PECUT” HARIAN LOMBOK POST EDISI OKTOBER DAN NOVEMBER 2015;SRI WAHYUNI;Universitas Mataram;;0;2017;#N/A;WY6AygvC5sMC;xmJJ9Y0AAAAJ
1370;Lactid acid bacteria isolates 18A (Lactococcus lactis ssp. lactis 1) colonic origin Bali cattle potential as probiotics.;IW Suardana, Y Ramona, S Wahyuni;Jurnal Veteriner;18 (3), 422-427;0;2017;#N/A;x-Ysmmx-H-kC;xmJJ9Y0AAAAJ
1371;The Administration of Epididymis Extract Increased the Testosterone Concentration without Affects the Dihydrotestosterone Concentration in Local Male Goat;N Yuliansyah, M Akmal, TN Siregar, S Wahyuni, M Abrar, S Syafruddin, ...;The International Journal of Tropical Veterinary and Biomedical Research;2 …;0;2017;#N/A;r7mTg6vxT4gC;xmJJ9Y0AAAAJ
