no;title;author;journal;number;cites;year;cid;pubid;id
1848;Pengaruh Struktur Kepemilikan (Ownership Structure) Terhadap Risk Management Disclosure (Studi Pada Perbankan Yang Listing Di Bursa Efek Indonesia Tahun 2010-2012);S Wahyuni;UNS (Sebelas Maret University);;0;2014;#N/A;-qpA3cGbmHsC;xmJJ9Y0AAAAJ
1849;Strategi Branding Kota Surakarta Sebagai Daerah Tujuan Wisata Melalui Slogan Solo The Spirit Of Java;S Wahyuni;UNS (Sebelas Maret University);;0;2014;#N/A;3WNXLiBY60kC;xmJJ9Y0AAAAJ
1850;SUBMODUL HAMPIR PRIMA (ON ALMOST PRIME SUBMODULES);D PATTY;Universitas Gadjah Mada;;0;2014;#N/A;-fu4zM_6qcIC;xmJJ9Y0AAAAJ
1851;KARAKTERISTIK MODUL PROYEKTIF ATAS DAERAH DEDEKIND;A Hadi;Universitas Gadjah Mada;;0;2014;#N/A;ZYsTHYU9jrMC;xmJJ9Y0AAAAJ
1852;Isolasi Senyawa Metabolit Sekunder Turunan Ftalat dari Jamur Endofitik Tumbuhan Brotowali (Tinospora crispa L);E Elfita, M Munawar, M Muharni, S Wahyuni;Jurusan Biologi FMIPA UNS;3, 241-244;0;2014;#N/A;5rMqqAh47xYC;xmJJ9Y0AAAAJ
1853;Distribution of carbohydrates in the salivary glands of water monitor (Varanus salvator).;I Nasution, A Saputra, M Jalaluddin, S Wahyuni;Jurnal Veteriner;15 (4), 523-529;0;2014;#N/A;u0Mu_IsstPMC;xmJJ9Y0AAAAJ
1854;Faktor-faktor yang mempengaruhi pengungkapan sustainability report pada perusahaan jasa yang terdaftar di BEI;S Wahyuni;Widya Mandala Catholic University;;0;2014;#N/A;MDX3w3dAD3YC;xmJJ9Y0AAAAJ
1855;STRATEGI PENGUASAAN RUANG PUBLIK OLEH SEKTOR INFORMAL DI JALAN KESEHATAN DEPAN RSUP SARDJITO YOGYAKRTA;SRI WAHYUNI;Universitas Gadjah Mada;;0;2014;#N/A;idthP5jqfYAC;xmJJ9Y0AAAAJ
1856;Retraction: Assessment of Public Perceptions of Urban Flood as AN Effective Approach for Disaster Mitigation: Example from Tulungagung, Indonesia;I Inagaki, D Sisinggih, S Wahyuni, RI Hapsari, K Sunada;土木学会論文集 B;B1 (水工学) 70 (4), I_1645-I_1645;0;2014;#N/A;3_LpOwP6eMYC;xmJJ9Y0AAAAJ
1857;Aplikasi Penjualan Berbasis Web Pada CV Sinonem Palembang;S Thahirah, S Wahyuni, I Pradesan;STMIK MDP;;0;2014;#N/A;xm0LlTxljI0C;xmJJ9Y0AAAAJ
1858;EFEKTIFITAS KOMBINASI PIJAT OKSITOSIN TEHNIK EFFLEURAGE DAN AROMATERAPI ROSE TERHADAP KADAR HORMON PROLAKTIN IBU POST PARTUM NORMAL DI WILAYAH PUSKESMAS DAWE KUDUS TAHUN 2013;J Jamilah, A Suwondo, S Wahyuni, S Suhartono;Jurnal Ilmu Kesehatan (JIK) Bhamada;5 (1), 16-16;0;2014;#N/A;lYAcb2jw7qUC;xmJJ9Y0AAAAJ
1859;Isolasi dan Karakterisasi Bakteri Manolitikasal Bonggol Pohon Sagu;SRI WAHYUNI, A KHAERUNI;Jurnal Agroteknos;4 (3);0;2014;#N/A;D_tqNUsBuKoC;xmJJ9Y0AAAAJ
1860;PERAMALAN FUNGSI TRANSFER SINGLE INPUT INDEKS HARGA SAHAM GABUNGAN TERHADAP SAHAM NEGARA TERDEKAT;S Wahyuni, IJ Suprayitno;Jurnal Statistika Universitas Muhammadiyah Semarang;2 (2);0;2014;#N/A;1tZ8xJnm2c8C;xmJJ9Y0AAAAJ
1861;Aktivitas Antifungi Ekstrak Metanol Daun Buas-Buas (Premna serratifolia) Terhadap Jamur Diplodia sp. Pada Jeruk Siam (Citrus nobilis var. microcarpa);S Wahyuni, AHY Mukarlina;Protobiont;3 (2);0;2014;#N/A;v6i8RKmR8ToC;xmJJ9Y0AAAAJ
1862;Pengembangan Kemampuan Emosional Melalui Metode Bercerita Pada Anak Kelompok A BA Aisyiyah Ngalas II Klaten Selatan Klaten Tahun Pelajaran 2013/2014;SRI WAHYUNI;Universitas Muhammadiyah Surakarta;;0;2014;#N/A;otzGkya1bYkC;xmJJ9Y0AAAAJ
1863;Dampak Perilaku Seksual Pranikah Pada Remaja;S Wahyuni;Universitas Muhammadiyah Surakarta;;0;2014;#N/A;wMgC3FpKEyYC;xmJJ9Y0AAAAJ
1864;Peningkatan Kemampuan Penalaran Mmatematika Melalui Strategi Pembelajaran Problem Based Learning Dengan Pendekatan Scientific Pada Pokok Bahasan Segiempat (PTK Pada siswa kelas …;SA Marfuah;Universitas Muhammadiyah Surakarta;;0;2014;#N/A;jL-93Qbq4QoC;xmJJ9Y0AAAAJ
1865;PEMETAAN KOMPETENSI PEDAGOGIK GURU TK DALAM MENGEMBANGKAN KURIKULUM PAUD DI KECAMATAN MARGOYOSO KABUPATEN PATI;S Wahyuni;BELIA: Early Childhood Education Papers;3 (2);0;2014;#N/A;_OXeSy2IsFwC;xmJJ9Y0AAAAJ
1866;Peningkatan Kemampuan Pemecahan Masalah Prediksi Soal-Soal Ujian Nasional Mata Pelajaran Matematika Melalui Pendekatan Jigsaw Pada Peserta Didik Kelas IX A SMP Negeri 4 …;S Wahyuni;Jurnal VARIDIKA;26 (2);0;2014;#N/A;_Ybze24A_UAC;xmJJ9Y0AAAAJ
1867;PELAKSANAAN DISTRIBUSI BERAS UNTUK KELUARGA MISKIN DI KELURAHAN BANSIR DARAT;S Wahyuni;PUBLIKA-Jurnal Ilmu Administrasi Negara;2 (3);0;2013;#N/A;pS0ncopqnHgC;xmJJ9Y0AAAAJ
1868;PENGGUNAAN METODE EKSPERIMEN UNTUK MENINGKATKAN AKTIVITAS DAN HASIL BELAJAR IPA POKOK BAHASAN PENGHANTAR PANAS PADA SISWA KELAS VI SDN 1 DAWUAN KECAMATAN SUBOH KABUPATEN …;S Wahyuni, AR Puspitaningtyas;Jurnal IKA PGSD (Ikatan Alumni PGSD) UNARS;1 (2), 65-78;0;2013;#N/A;MkYP4vM-iK8C;xmJJ9Y0AAAAJ
1869;Pengaruh Model Pembelajaran Inkuiri Terbimbing terhadap Kemampuan Berpikir Analitis pada Mata Pelajaran Geografi Siswa MA;S Wahyuni;SKRIPSI Jurusan Geografi-Fakultas Ilmu Sosial UM;;0;2013;#N/A;LHtfzE5_5AIC;xmJJ9Y0AAAAJ
1870;PERAN BADAN AMIL ZAKAT (BAZ) ROKAN HILIR (ROHIL) TERHADAP PENGEMBANGAN USAHA KECIL DI KECAMATAN BANGKO DI TINJAU MENURUT EKONOMI ISLAM;S Wahyuni;Universitas Islam Negeri Sultan Syarif Kasim Riau;;0;2013;#N/A;U_h31ocWZrQC;xmJJ9Y0AAAAJ
1871;ANALISIS KULAITAS PELAYANAN PUSKESMAS PETERONGAN BERDASARKAN THEORY OF CONSTRAINTS (TOC);SRI WAHYUNI;UNIVERSITAS AIRLANGGA;;0;2013;#N/A;pk6FPx6l9xIC;xmJJ9Y0AAAAJ
1872;Pengembangan Buku Panduan Praktikum Teknik Laboratorium II Untuk Meningkatkan Keterampilan Bereksperimen;S Wahyuni;Saintifika;15 (2);0;2013;#N/A;gV6rEsy15s0C;xmJJ9Y0AAAAJ
1873;UPAYA MENINGKATKAN MOTIVASI BELAJAR MATEMATIKA MELALUI METODE CARD SORT SISWA KELAS V MADRASAH IBTIDAIYAH DARUL JANNAH TELUK AIR KECAMATAN KARIMUN KABUPATEN KARIMUN;S Wahyuni;Universitas Islam Negeri Sultan Syarif Kasim Riau;;0;2013;#N/A;Jxw8hHINxX0C;xmJJ9Y0AAAAJ
1874;ANALYSIS OF INFLUENCE OF SERVICE QUALITY AND CUSTOMER SATISFACTION OF LOYALTY IN INDEPENDENT BANK (LIMITED), TBK JAKARTA BRANCH THAMRIN NINE;S Wahyuni, S Safaria;Sustainable Competitive Advantage (SCA);2 (1);0;2013;#N/A;DquSII9TDu4C;xmJJ9Y0AAAAJ
1875;MENINGKATKAN HASIL BELAJAR SISWA PADA MATA PELAJARAN ILMU PENGETAHUAN ALAM MATERI TUMBUHAN HIJAU MELALUI PEMBELAJARAN KOOPERATIF TIPE COLOR-CODED CO-OP DI KELAS V SDN 94 PEKANBARU;S Wahyuni;Universitas Islam Negeri Sultan Syarif Kasim Riau;;0;2013;#N/A;uqZYSrDi9MMC;xmJJ9Y0AAAAJ
1876;PENGUJIAN KETETAPAN MAJELIS PERMUSYAWARATAN RAKYAT DALAM SISTEM HUKUM INDONESIA;SRI WAHYUNI;UNIVERSITAS AIRLANGGA;;0;2013;#N/A;1DAnfT_YoJgC;xmJJ9Y0AAAAJ
1877;MOTIVASI BELAJAR SISWA PADA MATA PELAJARAN EKONOMI DI KELAS X MADRASAH ALIYAH NEGERI (MAN) KAMPAR KECAMATAN KAMPAR KEBUPATEN KAMPAR;S Wahyuni;Universitas Islam Negeri Sultan Syarif Kasim Riau;;0;2013;#N/A;GUJN1xMjMHAC;xmJJ9Y0AAAAJ
1878;Analisis Pengaruh Intelectual Capital Terhadap Reaksi Investor Pada Perusahaan Otomotif Yang Terdaftar DI Bursa Efek Indonesia;S Wahyuni;;;0;2013;#N/A;UuEBAcK4md4C;xmJJ9Y0AAAAJ
1879;R&D PENGEMBANGAN PROFESI GURU: UP GRADING KOMPETENSI GURU MGMP IPA KOTA SEMARANG MELALUI STRATEGI PEMBELAJARAN ACTIVE LEARNING DAN LESSON STUDY TERPROGRAM;ER Mulyaningrum, M Sulistyoningsih, A Nurwahyunani, S Wahyuni, ...;SEMINAR HASIL-HASIL PENELITIAN;2012;0;2013;#N/A;Aul-kAQHnToC;xmJJ9Y0AAAAJ
1880;PELAYANAN DAN ORIENTASI PELANGGAN TERHADAP LOYALITAS DENGAN KEPUASAN SEBAGAI VARIABEL INTERVENING PADA PENGGUNA KARTU KREDIT BCA;S Wahyuni;Perbanas Institute;;0;2013;#N/A;WIXB4To3Tx4C;xmJJ9Y0AAAAJ
1881;PERBEDAAN KEMAMPUAN PEMAHAMAN KONSEP DAN BERPIKIR KRITIS SISWA SMA ANTARA YANG DIBERI PEMBELAJARAN BERBASIS MASALAH DENGAN PENGAJARAN LANGSUNG;S Wahyuni;UNIMED;;0;2013;#N/A;SyxJh60XUSQC;xmJJ9Y0AAAAJ
1882;EFEKTIVITAS PENGGUNAAN ANTARA BETADIN DAN ALKOHOL TERHADAP PENYEMBUHAN LUKA TALI PUSAT BAYI BARU LAHIR DI RUANG LONTARA 4 ANAK RSUP. DR. WAHIDIN SUDIROHUSODO MAKASSAR;A Rahim, S Wahyuni, J Junaidi;Jurnal Ilmiah Kesehatan Diagnosis;3 (2), 115-118;0;2013;#N/A;Fv7Qhv_DOnIC;xmJJ9Y0AAAAJ
1883;HUBUNGAN DUKUNGAN KELUARGA DAN LINGKUNGAN RUMAH SAKIT DENGAN REAKSI HOSPITALISASI PADA ANAK USIA SEKOLAH DI RSUP DR. WAHIDDIN SUDIROHUSODO MAKASSAR;EH Hukom, S Wahyuni, J Junaidi;Jurnal Ilmiah Kesehatan Diagnosis;3 (2), 32-39;0;2013;#N/A;m1cs02wJCiwC;xmJJ9Y0AAAAJ
1884;HUBUNGAN UKURAN PERUSAHAAN DAN SENSITIVITAS LINGKUNGAN DENGAN KUANTITAS DAN KUALITAS PENGUNGKAPAN LINGKUNGAN (Studi pada Perusahaan Non Keuangan yang Terdaftar di Bursa Efek …;SRI WAHYUNI;ETD Unsyiah;;0;2013;#N/A;M_lZXyI38BkC;xmJJ9Y0AAAAJ
1885;Morfologi Kelenjar Aksesori Kelamin Muncak (Muntiacus muntjak muntjak) Jantan;S Wahyuni, LEM Manik, S Agungpriyono, M Agil, TL Yusuf, IKM Adnyane;Acta VETERINARIA Indonesiana;1 (2), 80-90;0;2013;#N/A;ZzlSgRqYykMC;xmJJ9Y0AAAAJ
1886;PENERAPAN METODE TUTOR SEBAYA PADA PEMBELAJARAN SENI MUSIK DI SMAN 4 MUARA BUNGO;S Wahyuni, TH Kadir, JL Toruan;Jurnal Sendratasik;2 (1), 49-55;0;2013;#N/A;Ehil0879vHcC;xmJJ9Y0AAAAJ
1887;Perencanaan Bendungan Manonjaya Kabupaten Tasikmalaya, Jawa Barat;MQ Hidayat, KA Shofa, SE Wahyuni, S Darsono;JURNAL KARYA TEKNIK SIPIL;2 (3), 189-204;0;2013;#N/A;bcT4vkklUMwC;xmJJ9Y0AAAAJ
1888;Perencanaan Check Dam Sungai Dawe Kudus;A Mustaanah, N Pinandoyo, S Sugiyanto, SE Wahyuni;JURNAL KARYA TEKNIK SIPIL;2 (3), 240-244;0;2013;#N/A;wSy_KLzO7YEC;xmJJ9Y0AAAAJ
1889;Penerapan Kolaborasi Model Pembelajaran Probing Prompting Dengan Mindful Learning Untuk Meningkatkan Aktivitas Dan Hasil Belajar Akuntansi Siswa Kelas XI Ak SMK Swasta Al Ma …;S Wahyuni;Penerapan Kolaborasi Model Pembelajaran Probing Prompting Dengan Mindful …;;0;2013;#N/A;dQ2og3OwTAUC;xmJJ9Y0AAAAJ
1890;FAKTOR-FAKTOR YANG BERHUBUNGAN DENGAN KEJADIAN DERMATITIS ATOPIK PADA BALITA DI PUSKESMAS CEMPA KECAMATAN CEMPA KABUPATEN PINRANG;L Lispajrianah, S Wahyuni, A Rahman;Jurnal Ilmiah Kesehatan Diagnosis;3 (1), 129-136;0;2013;#N/A;VGxY11nYJJYC;xmJJ9Y0AAAAJ
1891;ANALISIS PENGARUH TEKNOLOGI TERHADAP PERTUMBUHAN EKONOMI PROVINSI ACEH (AK MODEL);S Wahyuni, A Hamzah, S Syahnur;Jurnal Ilmu Ekonomi: Program Pascasarjana Unsyiah;1 (3);0;2013;#N/A;PuYkdpj8xa4C;xmJJ9Y0AAAAJ
1892;PENURUNAN KADAR LINEAR ALKYL SULFONATE OLEH FOTOKATALIS TiO2/ZEOLIT ALAM;AWW Hartoyo, S Wahyuni, H Harjito;Indonesian Journal of Chemical Science;2 (2);0;2013;#N/A;-yGd096yOn8C;xmJJ9Y0AAAAJ
1893;Attitudinal Epithets in a Children Science Book: A Functional Grammar Analysis;S Wahyuni, ETS Sujatna, E Citraresmana;International Journal of English Linguistics;3 (4), 71;0;2013;#N/A;NU-BerS4NX4C;xmJJ9Y0AAAAJ
1894;Implementasi Kebijakan Pelayanan Kesehatan Dasar Gratis (Studi pada Puskesmas Kecamatan Sukamara Kabupaten Sukamara);S Wahyuni;Universitas Terbuka;;0;2013;#N/A;Z7R3Ocg27JUC;xmJJ9Y0AAAAJ
1895;FAKTOR-FAKTOR YANG MEMPENGARUHI TINGKAT KECEMASAN IBU SEBELUM PEMBERIAN IMUNISASI DPT PADA BAYI DI WILAYAH KERJA PUSKESMAS SAMATARING KABUPATEN SINJAI;H Hayana, S Wahyuni, A Kadir;Jurnal Ilmiah Kesehatan Diagnosis;2 (6), 88-95;0;2013;#N/A;zLla2nKXDtwC;xmJJ9Y0AAAAJ
1896;PERUNDUNGAN BAHASA DAERAH MELALUI PENGGUNAAN LOGAT DIALEK DALAM TAYANGAN SINETRON DI TELEVISI;S Wahyuni;;;0;2013;#N/A;oy0z8GdgWhYC;xmJJ9Y0AAAAJ
1897;ANALISA STATIK STRUKTUR ATAS JEMBATAN KOMPOSIT PERMODELAN JEMBATAN KERAMAT TARAKAN DENGAN SAP2000 VERSI 7.40 (STUDENT VERSION);S Wahyuni;;;0;2013;#N/A;kzcSZmkxUKAC;xmJJ9Y0AAAAJ
1898;PENINGKATAN PENGETAHUAN REMAJA TENTANG KEHAMILAN TIDAK DIINGINKAN (KTD) DENGAN MENGGUNAKAN METODE ROLE PLAY PADA SISWA KELAS XI SMK;RS Puspitasari, E Suryani, S Wahyuni;Jurnal Ilmu Keperawatan dan Kebidanan;1 (8);0;2013;#N/A;DTjSuSUbmXsC;xmJJ9Y0AAAAJ
1899;Julo-Julo Tani Buruh Perempuan Jorong Patamuan, Nagari Talu Kecamatan Talamu Kab. Pasaman Barat;S Wahyuni, Z Zusmelia, D Syafrini;Jurnal Ilmu Sosial Mamangan;2 (1), 8-14;0;2013;#N/A;HKuYlFsi-qEC;xmJJ9Y0AAAAJ
1900;PENINGKATAN HASIL BELAJAR SISWA DALAM PEMBELAJARAN IPA MELALUI PENDEKATAN INKUIRI DI SEKOLAH DASAR;M Musniarti;e-Journal Pembelajaran Inovasi, Jurnal Ilmiah Pendidikan Dasar;1 (1);0;2013;#N/A;D03iK_w7-QYC;xmJJ9Y0AAAAJ
1901;PERSEPSI PEMBELAJARAN TENTANG LABORATORIUM KAITANYA DENGAN KEPUASAN MAHASISWA;K Kuswati, S Wahyuni, K Kistijah;Interest: Jurnal Ilmu Kesehatan;2 (1);0;2013;#N/A;YohjEiUPhakC;xmJJ9Y0AAAAJ
1902;Meningkatkan Aktivitas Belajar Siswa Dengan Menggunakan Pembelajaran Tematik Model Paikem Dikelas II SD Swasta Ikal Medan TA 2012/2013;S Wahyuni;Meningkatkan Aktivitas Belajar Siswa Dengan Menggunakan Pembelajaran Tematik …;;0;2013;#N/A;c5UgKxj1dGoC;xmJJ9Y0AAAAJ
1903;Meningkatkan hasil belajar siswa kelas IV pada pokok bahasan penggolongan hewan melalui model pembelajaran konstruktivisme di SD Negeri No. 104230 Tanjung Sari;S Wahyuni;Meningkatkan hasil belajar siswa kelas IV pada pokok bahasan penggolongan …;;0;2013;#N/A;8xutWZnSdmoC;xmJJ9Y0AAAAJ
1904;Pengaruh Model Pembelajaran Berbasis Masalah Terhadap Pemahaman Konsep Matematika Siswa;S Wahyuni, SH Noer, P Gunowibowo;Jurnal Pendidikan Matematika Unila;1 (2);0;2013;#N/A;xyhAN3YsZoYC;xmJJ9Y0AAAAJ
1905;بيرعلا لماعلا في ةييزكلنالا ةغللا لةمج;S Faiq, JG Mallia, A Shunnaq, F Afif, ALH Ahmad, M El Hage;Arab World English Journal (AWEJ);;0;2013;#N/A;r90dRYkPj7EC;xmJJ9Y0AAAAJ
1906;EVALUASI DAN PERENCANAAN KEMBALI BENDUNG SAPON;FN Utomo, DW Apriani, SE Wahyuni, S Hardiyati;JURNAL KARYA TEKNIK SIPIL;2 (2), 397-405;0;2013;#N/A;_V0JUKP8578C;xmJJ9Y0AAAAJ
1907;Perencanaan Pembangkit Listrik Tenaga Mikrohidro (Pltmh) Karangtalun, Kabupaten Temanggung;RR Aprilianto, A Fungkas, SE Wahyuni, S Suharyanto;JURNAL KARYA TEKNIK SIPIL;2 (2), 76-107;0;2013;#N/A;vlMkzkLhH4wC;xmJJ9Y0AAAAJ
1908;SISTEM PENYALURAN KREDIT BAKULAN PADA BANK PD. BPR SARIMADU BANGKINANG;SRI WAHYUNI;Universitas Islam Negeri Sultan Syarif Kasim Riau;;0;2013;#N/A;y7JhAc_VBLgC;xmJJ9Y0AAAAJ
1909;KEMAMPUAN MENULIS SURAT IZIN SISWA KELAS VII SMPN 18 PADANG;S Wahyuni;Abstract of Undergraduate, Faculty of Education, Bung Hatta University;1 (6);0;2013;#N/A;owLR8QvbtFgC;xmJJ9Y0AAAAJ
1910;A STUDY ON THE TECHNIQUE OF TEACHING SPEAKING IN BILINGUAL CLASS TO THE GRADE XI AT MAN 3 MALANG;SRI WAHYUNI;University of Muhammadiyah Malang;;0;2013;#N/A;PazO6pb-sMwC;xmJJ9Y0AAAAJ
1911;PENGARUH HUBUNGAN PARTISIPASI TERHADAP KEPUASAN PEMAKAI DALAM PENGEMBANGAN SISTEM INFORMASI DENGAN DUKUNGAN MANAJEMEN PUNCAK SEBAGAI VARIABEL MODERATING;S Wahyuni;Jurnal Pendidikan Akuntansi (JPAK);1 (1);0;2013;#N/A;WgvcDLhf7hwC;xmJJ9Y0AAAAJ
1912;"THE EFFECT OF AUDITOR QUALITY ON BOND RATING: THE TESTING OF"" INFORMATION ROLE"" AUDITORS IN INDONESIA";S Wahyuni;Journal of Economics, Business & Accountancy Ventura;16 (1);0;2013;#N/A;TaaCk18tZOkC;xmJJ9Y0AAAAJ
1913;ABSTRAK MENINGKATKAN KEMAMPUAN MENULIS CERITA MENGGUNAKAN MEDIA GAMBAR SERI PADA MATA PELAJARAN BAHASA INDONESIA KELAS IV SDN 1 PERESAK TAHUN PELAJARAN 2012/2013;SRIWSRI WAHYUNI;JURNAL PPKHB;1 (1);0;2013;#N/A;Br1UauaknNIC;xmJJ9Y0AAAAJ
1914;Studi Tentang Perkembangan Desa di Wilayah Kecamatan Pancur Batu Kabupaten Deli Serdang tahun 2001-2010;S Wahyuni;UNIMED;;0;2013;#N/A;blknAaTinKkC;xmJJ9Y0AAAAJ
1915;Penerapan Hasil Belajar “Membuat Pola Kemeja Di Atas Kain” Pada Pembuatan Pola Kemeja Konfeksi Dalam Praktek Kerja Lapangan;S Wahyuni;Universitas Pendidikan Indonesia;;0;2013;#N/A;1u-ON_Kw9acC;xmJJ9Y0AAAAJ
1916;Peningkatan Hasil Belajar Siswa pada Pokok Bahasan Operasi Hitung dengan menggunakan Metode Drill di kelas III SD Negeri 058374 Sei Limbat.;S Wahyuni;Peningkatan Hasil Belajar Siswa pada Pokok Bahasan Operasi Hitung dengan …;;0;2013;#N/A;-_dYPAW6P2MC;xmJJ9Y0AAAAJ
1917;FAKTOR YANG BERHUBUNGAN DENGAN KEJADIAN DIARE PADA ANAK USIA SEKOLAH DI WILAYAH KERJA PUSKESMAS SALOTUNGO KAB. SOPPENG;F Ansyari, S Wahyuni, A Ipa;Jurnal Ilmiah Kesehatan Diagnosis;2 (1), 130-138;0;2013;#N/A;R22Rs3tN8aoC;xmJJ9Y0AAAAJ
1918;Evaluasi Dan Perencanaan Kembali Bendung Sapon;DW Apriani, FN Utomo, SE Wahyuni, S Hardiyati;JURNAL KARYA TEKNIK SIPIL;2 (1), 34-42;0;2013;#N/A;wdLM4YbmhYkC;xmJJ9Y0AAAAJ
1919;Perencanaan Bendung Progo Jumo, sungai Progo Kabupaten Temanggung;BB Indra, LJ Angghita, SE Wahyuni, D Kurniani;JURNAL KARYA TEKNIK SIPIL;2 (1), 101-110;0;2013;#N/A;1TqUyixsFioC;xmJJ9Y0AAAAJ
1920;PERANAN KOORDINASI TERHADAP PRODUKTIVITAS KERJA PEGAWAI PADA KANTOR DINAS PEKERJAAN UMUM PROVINSI KALIMANTAN TIMUR;S Wahyuni;PREDIKSI;1 (1), 102-107;0;2013;#N/A;eJXPG6dFmWUC;xmJJ9Y0AAAAJ
1921;Penyesuanian Diri Mantan Anak Didik Lembaga Permasyarakatan Palembang Kelas IIA Saat Kembali Ke Masyarakat Tahun 2012;I Kusumawaty, Y Yunike, S Wahyuni;JPP Jurnal Kesehatan Poltekkes Palembang;1 (11), 1-9;0;2013;#N/A;8BwKzHq_VgYC;xmJJ9Y0AAAAJ
1922;KONSERVASI KOLEKSI TINGGALAN KOLONIAL DI PULAU MOROTAI (MALUKU UTARA);S Wahyuni, YAH Purnama;Jurnal Konservasi Cagar Budaya Borobudur;7 (2), 71-81;0;2013;#N/A;N-Wl9uZK064C;xmJJ9Y0AAAAJ
1923;EFEKTIVITAS EDTA DALAM MEMBERSIHKAN LAPISAN KERAK PADA CAGAR BUDAYA BERBAHAN BATU;A Swastikawati, FD Ekarini, S Wahyuni;Jurnal Konservasi Cagar Budaya Borobudur;7 (2), 60-70;0;2013;#N/A;CxegcQ4u50YC;xmJJ9Y0AAAAJ
1924;PENGARUH PEMBERIAN GOLD STANDARD MINUMAN ISOTONIK DAN PLAIN WATER TERHADAP STATUS HIDRASI LANSIA DENGAN MELIHAT VOLUME URIN TAMPUNG 24 JAM;SP WAHYUNI;Universitas Gadjah Mada;;0;2013;#N/A;unKmnnpx3RcC;xmJJ9Y0AAAAJ
1925;PERAN ORANG TUA DALAM PENANAMAN NILAI ISLAMI PADA ANAK USIA 3-6 TAHUN MELALUI KEGIATAN BERMAIN;SRI WAHYUNI;Universitas Muhammadiyah Palembang;;0;2013;#N/A;abCsMXLaarkC;xmJJ9Y0AAAAJ
1926;Pengelolaan Pembelajaran Berbahasa di TK Negeri Pembina Jatipurno;D Wahyuni;Universitas Muhammadiyah Surakarta;;0;2013;#N/A;k4O5U3vRA4YC;xmJJ9Y0AAAAJ
1927;Nutrigenomik;S Wahyuni;Majalah IDI Cabang Aceh Utara-Lhokseumawe;8, 28-31;0;2013;#N/A;_q7R20eJROoC;xmJJ9Y0AAAAJ
1928;IDENTIFIKASI PARASIT PADA IKAN AIR TAWAR DI BALAI BENIH IKAN BABAH KRUENG KECAMATAN BEUTONG KABUPATEN NAGAN RAYA;S Wahyuni;universitas teuku umar meulaboh;;0;2013;#N/A;1QLOHW2CHAAC;xmJJ9Y0AAAAJ
1929;Perbedaan Hasil Belajar Siswa Menggunakan Model Pembelajaran Kooperatif Tipe Student Teams Achievement Division (Stad) dengan Pembelajaran Konvensional pada Mata Pelajaran …;R Afriza, S Wahyuni, Y Putri;Pendidikan Ekonomi;2 (2);0;2013;#N/A;Q4B7mEBXgMkC;xmJJ9Y0AAAAJ
1930;DEVELOPING TEACHERS’PEDAGOGICAL COMPETENCE THROUGH LESSON STUDY;S Wahyuni;UNNES International Conference on ELTLT (English Language Teaching …;;0;2013;#N/A;mqcSLZKRP28C;xmJJ9Y0AAAAJ
1931;Pengembangan Bahan Ajar Materi Morfologi Gigi;S Wahyuni, S Sudjarwo, H Herpratiwi;Jurnal Teknologi Informasi Komunikasi Pendidikan;1 (4);0;2013;#N/A;ult01sCh7k0C;xmJJ9Y0AAAAJ
1932;Meningkatkan Hasil Belajar IPA Tentang Kesehatan Melalui Metode Problem Solving Siswa Kelas II SDN 05 Karangbener Semester I Tahun 2012;S Wahyuni;Program Studi Pendidikan Guru Sekolah Dasar PSKGDJ FKIP-UKSW;;0;2013;#N/A;b2kfBsK7yCQC;xmJJ9Y0AAAAJ
1933;User Satisfaction Performance Analysis Of Midwives And Nurses Graduate Hospital In Semarang City And County;S Wahyuni, WS Adi, S Sudiyono;LINK;9 (3), 635-640;0;2013;#N/A;kxd3qP2_5uAC;xmJJ9Y0AAAAJ
1934;Hubungan Antara Ekspansi Thoraks Dan Indeks Massa Tubuh Dengan VO2max Pada Lanjut Usia (Lansia);W Fitrianti, SS Wahyuni;Universitas Muhammadiyah Surakarta;;0;2013;#N/A;Qh5Z_vBjo80C;xmJJ9Y0AAAAJ
1935;EFEKTIVITAS ARANG AKTIF DIPERKAYA MIKROBA KONSORSIA TERHADAP RESIDU INSEKTISIDA LINDAN DAN ALDRIN DI LAHAN SAYURAN;ES Harsanti, I Indratin, S Wahyuni, E Sulaeman, AN Ardiwinata;Jurnal Ecolab;7 (1), 27-36;0;2013;#N/A;Amrzk_ktLr0C;xmJJ9Y0AAAAJ
1936;Pembuatan dan Karakterisasi Membran Hibrida Kitosan-Silika-PEG;FW Mahatmanti, S Wahyuni;Sainteknol: Jurnal Sains dan Teknologi;11 (2);0;2013;#N/A;yaBp1wUtcLsC;xmJJ9Y0AAAAJ
1937;STRATEGI PEMERINTAHAN JOHN HOWARD DALAM PELOLOSANUNDANG-UNDANG ANTI-TERORISME 2005;ASAA PRIWANTORO, E Hiariej;Text;;0;2013;#N/A;rJyh6hJnyfgC;xmJJ9Y0AAAAJ
1938;Peningkatan Minat Membaca Pada Anak Kelompok B Melalui Media Kartu Kata Di TK Pertiwi 2 Manggis, Mojosongo, Boyolali Tahun Pelajaran 2013/2014;S Wahyuni;Universitas Muhammadiyah Surakarta;;0;2013;#N/A;9CGX2owmTHMC;xmJJ9Y0AAAAJ
1939;PERAN HIMPUNAN SANDWICH DALAM INVERS TERGENERALISASI PERKALIAN MATRIKS;BDA PRAYANTI;Universitas Gadjah Mada;;0;2013;#N/A;QeguYG95ZbAC;xmJJ9Y0AAAAJ
1940;TEOREMA FUNDAMENTAL HOMOMORFISMA DAN LOKALISASI PADA SEMIRING;S Wahyuni;Universitas Gadjah Mada;;0;2013;#N/A;tgTmbKTkO1IC;xmJJ9Y0AAAAJ
1941;USING AUTHENTIC MATERIALS TO IMPROVE READING COMPREHENSION OF THE SEVENTH GRADE STUDENTS OF SMP MUHAMMADIYAH 10 YOGYAKARTA IN THE ACADEMIC YEAR OF;S Wahyuni;YOGYAKARTA STATE UNIVERSITY;;0;2013;#N/A;Nnq8S6OXqDYC;xmJJ9Y0AAAAJ
1942;Perbedaan Hasil Belajar Ekonomi Menggunakan Model Pembelajaran Kooperatif Nht dengan Pembelajaran Konvensional;LDSW Sumarni;ECONOMICA JOURNAL: Research of Economic And Economic Education;1 (2), 245-251;0;2013;#N/A;3MwzVuqRcA0C;xmJJ9Y0AAAAJ
1943;THE USE OF SNOWBALLING STRATEGY IN TEACHING READING LITERARY TEXTS (SHORT STORIES);S Wahyuni;Language Circle: Journal of Language and Literature;7 (2);0;2013;#N/A;m4fbC6XIj1kC;xmJJ9Y0AAAAJ
1944;Simulasi Penerimaan Siswa Baru Di SMP Kartasura;S Wahyuni;Universitas Muhammadiyah Surakarta;;0;2013;#N/A;3NQIlFlcGxIC;xmJJ9Y0AAAAJ
1945;Upaya Peningkatan Partisipasi Siswa Melalui Penggunaan Media Gambar Pada Mata Pelajaran IPS Materi Mengidentifikasi Benua–Benua Pada Siswa Kelas VI SDN 02 Dawung Kecamatan …;S Wahyuni;Universitas Muhammadiyah Surakarta;;0;2013;#N/A;uDGL6kOW6j0C;xmJJ9Y0AAAAJ
1946;Rhizome yield and size variation of Zingiber aromaticum propagated from true seed;S Wahyuni;Pusat Penelitian dan Pengembangan Perkebunan;;0;2013;#N/A;2VqYfGB8ITEC;xmJJ9Y0AAAAJ
1947;ANALISIS CITRA UNTUK ANGIOGRAFI DIGITAL SINAR X DENGAN MEDIA KONTRAS: KASUS VENTRIKEL SEPTAL DEFECT (VSD);SRI WAHYUNI, GB Suparta;Universitas Gadjah Mada;;0;2013;#N/A;_FM0Bhl9EiAC;xmJJ9Y0AAAAJ
1948;Online Classroom dengan Pemanfaatan K12lessonplans Bagi Guru-guru SMP. H. Isriati Semarang;S Wahyuni, LN Affini;E-Dimas: Jurnal Pengabdian kepada Masyarakat;4 (1), 59-66;0;2013;#N/A;2KloaMYe4IUC;xmJJ9Y0AAAAJ
1949;Toxoplasmosis Dalam Kehamilan;S Wahyuni;BALABA: JURNAL LITBANG PENGENDALIAN PENYAKIT BERSUMBER BINATANG BANJARNEGARA …;;0;2013;#N/A;LPZeul_q3PIC;xmJJ9Y0AAAAJ
1950;Indonesia Tax Audit Guideline for Affiliated Transactions;S Wahyuni;Int'l Tax Rev.;24, 65;0;2013;#N/A;K3LRdlH-MEoC;xmJJ9Y0AAAAJ
1951;Aplikasi Pemetaan Lokasi SMP Negeri di Jakarta Selatan Pada Platform Android dengan Menggunakan Eclipse;S Wahyuni;;;0;2012;#N/A;kRWl-cVF35UC;xmJJ9Y0AAAAJ
1952;PEMBUATAN WEBSITE PEMESANAN TIKET TRAVEL DENGAN MENGGUNAKAN PHP, MYSQL DAN ADOBE DREAMWEAVER CS4;S Wahyuni;;;0;2012;#N/A;MTuJV9umhWMC;xmJJ9Y0AAAAJ
1953;EVALUASI KUALITAS DAN ISI KONSELING PRA TESTING PADA PELAKSANAAN VOLUNTARY COUNSELLING AND TESTING (VCT) DI PUSKESMAS PUTAT JAYA SURABAYA;S WAHYUNI;UNIVERSITAS AIRLANGGA;;0;2012;#N/A;t7izwRedFcYC;xmJJ9Y0AAAAJ
1954;Sistem Informasi Katalog Diklat Dan Registrasi Online Badan Pendidikan Dan Pelatihan Kementerian Energi Dan Sumber Daya Mineral Untuk Pusdiklat Mineral Dan Batu Bara;S Wahyuni;;;0;2012;#N/A;u-coK7KVo8oC;xmJJ9Y0AAAAJ
1955;Pengaruh motivasi kerja dan pelatihan kerja terhadap kinerja melalui kepuasan kerja karyawan (studi pada karyawan PT. BRI Tbk. Kantor Cabang Blitar);S Wahyuni;Pengaruh motivasi kerja dan pelatihan kerja terhadap kinerja melalui …;;0;2012;#N/A;0CzhzZyukY4C;xmJJ9Y0AAAAJ
1956;DEMOKRASI DAN NEGARA HUKUM DALAM ISLAM;S Wahyuni;Jurnal Review Politik;2 (02), 154;0;2012;#N/A;adHtZc2wMuEC;xmJJ9Y0AAAAJ
1957;ANALISIS FAKTOR-FAKTOR YANG MEMPENGARUHI PRICE TOBOOK VALUE DAN IMPLIKASINYA PADA RETURN SAHAM (Studi Empiris: pada Perusahaan Manufaktur yang Terdaftar di Bursa Efek Indonesia);S Wahyuni, C Nuswandari;Students' Journal of Accounting and Banking;1 (1);0;2012;#N/A;VRfTbSk87rEC;xmJJ9Y0AAAAJ
1958;Efektifitas Reminiscence Group Therapy Terhadap Harga Diri Lansia Yang Mengalami Depresi Di Kecamatan Medan Johor;W Daulay, SE Wahyuni, ML Nasution;;;0;2012;#N/A;p9YawgimX9oC;xmJJ9Y0AAAAJ
1959;ANALISIS PERBEDAAN MOTIVASI ANTARA KARYAWAN PUSAT PEMBINAAN USAHA DAN KELEMBAGAAN DENGAN PUSAT PEMBINAAN PENYELENGGARAAN KONSTRUKSI BADAN PEMBINAAN KONSTRUKSI KEMENTERIAN …;SRIWDWI WAHYUNI;UNIVERSITAS AIRLANGGA;;0;2012;#N/A;MbTKqoTs-1EC;xmJJ9Y0AAAAJ
1960;Kongruensi Unsur Idempoten Ortogonal dalam Aljabar Insidensi Finitary;E Carnia, S Wahyuni;Jurnal Natur Indonesia;13 (02), 89-93;0;2012;#N/A;aU4yMueWZ3QC;xmJJ9Y0AAAAJ
1961;Penerapan Metode Peta Pikiran (Mend Map) Untuk Meningkatkan Motivasi Berprestasi Siswa Kelas III SD 2 Teluk Wetan Welahan Jepara Pada Semester Genap Tahun 2011/2012;S Wahyuni;Universitas Muria kudus;;0;2012;#N/A;RGFaLdJalmkC;xmJJ9Y0AAAAJ
1962;METODE EKSTRAKSI PELARUT BERBANTUAN ULTRASONIK UNTUK RECOVERY MINYAK DARI LIMBAH CAIR PABRIK KELAPA SAWIT Application of Ultrasound-assisted Solvent Extraction for Recovery of …;MD Supardan, TM Asnawi, Y Putri, S Wahyuni;Jurnal Agritech Fakultas Teknologi Pertanian UGM;31 (04);0;2012;#N/A;gmHTDCtJMcoC;xmJJ9Y0AAAAJ
1963;Faktor-faktor yang berhubungan dengan penyakit diabetes melitus (DM) dat sekunder riskesdas 2007;S Wahyuni;UIN Syarif Hidayatullah Jakarta: Fakultas Kedokteran Dan Ilmu Kesehatan;2010;0;2012;#N/A;2l5NCbZemmgC;xmJJ9Y0AAAAJ
1964;PENGARUH TAYANGAN KULINER DI TELEVISI TERHADAP KREATIVITAS MEMASAK IBU RUMAH TANGGA RT. 02 RW. 01 KELURAHAN TUAH KARYA KECAMATAN TAMPAN;S Wahyuni;Universitas Islam Negeri Sultan Syarif Kasim Riau;;0;2012;#N/A;3UHJKpZgG5wC;xmJJ9Y0AAAAJ
1965;Penggunaan Media Pembelajaran Doraemon Pintar Untuk Meningkatkan Kemampuan Sosial Emosional Anak Kelompok B Lion TK Laboratorium UM;S Wahyuni;SKRIPSI Jurusan Kependidikan Sekolah Dasar & Prasekolah-Fakultas Ilmu …;;0;2012;#N/A;7VEv-pLvLSsC;xmJJ9Y0AAAAJ
1966;ANALISIS PENGARUH JASA PERBANKAN TERHADAP KEPUASAN NASABAH PADA PT. BANK RIAU CABANG BANGKINANG;S Wahyuni;Universitas Islam Negeri Sultan Syarif Kasim Riau;;0;2012;#N/A;QxlgOPrhsAcC;xmJJ9Y0AAAAJ
1967;PENERAPAN METODE PERMAINAN DENGAN TEKNIK JARIMATIKA UNTUK MENINGKATKAN PEMAHAMAN KONSEP PERKALIAN BILANGAN ASLI DI KELAS IV SD NEGERI 098024 PP. MARIHAT KEC. UJUNG …;S Wahyuni;UNIMED;;0;2012;#N/A;-0tLmPFCw2kC;xmJJ9Y0AAAAJ
1968;PERTUMBUHAN SEMAI NYATOH (Palaquium amboinensis) ASAL CABUTAN ALAM PADA BERBAGAI MEDIA TANAM;S Wahyuni;Universitas Negeri Papua;;0;2012;#N/A;Dip1O2bNi0gC;xmJJ9Y0AAAAJ
