no;title;author;journal;number;cites;year;cid;pubid;id
1;Perencanaan Pembelajaran Sejarah;S Leo Agung, S Wahyuni;Ombak;;90;2013;4791009832465137711;LimhlhUO2s4C;xmJJ9Y0AAAAJ
2;Pengaruh rasio keuangan terhadap pertumbuhan laba pada perusahaan perdagangan di Indonesia;A Gunawan, SF Wahyuni;Jurnal Ilmiah Manajemen dan Bisnis;13 (1);59;2014;13442888371042221010;OWf_fnsf0g4C;xmJJ9Y0AAAAJ
3;Menghasilkan Biogas dari Aneka Limbah (Revisi);S Wahyuni, SE MP;AgroMedia;;57;2011;10801750838807151444;RHpTSmoSYBkC;xmJJ9Y0AAAAJ
4;Metodologi Penelitian Bisnis dan Pendidikan;A Wahyudin;Semarang: Unnes Press. Edisi;1, 2015;46;2015;1590134322212923419;1EqfMoDn7-AC;xmJJ9Y0AAAAJ
5;Buku pintar kelapa sawit;RE Lubis, SP Agus Widanarko;AgroMedia;;45;2011;5259070054955531022;f4T9rk490XkC;xmJJ9Y0AAAAJ
6;Hubungan antara kepercayaan diri dengan kecemasan berbicara di depan umum pada mahasiswa psikologi;S Wahyuni;Jurnal Psikologi;2 (1), 50-64;38;2014;7779173563464747093;m03se8k-GH0C;xmJJ9Y0AAAAJ
7;Memproduksi Benih Bersertifikat;B Wirawan, S Wahyuni;Penebar Swadaya, Jakarta;;37;2002;697966313749274786;knQODA9bSJkC;xmJJ9Y0AAAAJ
8;Studi Tentang Pembelajaran Kooperatif Terhadap Hasil Belajar Matematika;D Wahyuni;Malang: Program Sarjana Universitas Negeri Malang;;35;2001;4998696460120731845;yptliwwhi3IC;xmJJ9Y0AAAAJ
9;Sucutiniranes A and B, new cassane-type diterpenes from Bowdichia nitida;Y Matsuno, J Deguchi, Y Hirasawa, K Ohyama, H Toyoda, C Hirobe, ...;Bioorganic & medicinal chemistry letters;18 (13), 3774-3777;34;2008;15023902423443625339;mKu_rENv82IC;xmJJ9Y0AAAAJ
10;Agribisnis Tanaman Buah;F Rahardi, YH Indriani, Haryono;Penebar Swadaya;;33;1998;16354611225514638300;3YQzwbzlpKYC;xmJJ9Y0AAAAJ
11;Faktor-faktor yang mempengaruhi perilaku deteksi dini kanker serviks di kecamatan ngampel Kabupaten Kendal Jawa Tengah;S Wahyuni;Jurnal Keperawatan Maternitas;1 (1);27;2013;13932209132095216629;YB4bud6kWLwC;xmJJ9Y0AAAAJ
12;?????????????????????????????????????????????????? 2013???????????????????????????????????????????????????;S Wahyuni;AL-WIJDÁN: Journal of Islamic Education Studies;2 (2), 33-39;25;2017;17227982061004564275,12259062166904192675;Xxrp-jDxsD4C;xmJJ9Y0AAAAJ
13;Lecturers’ understanding on indexing databases of SINTA, DOAJ, Google Scholar, SCOPUS, and Web of Science: A study of Indonesians;AS Ahmar, N Kurniasih, DE Irawan, DU Sutiksno, D Napitupulu, ...;Journal of Physics: Conference Series;954 (1), 012026;23;2018;7143758658041603615;qyhmnyLat1gC;xmJJ9Y0AAAAJ
14;Preparasi Nanopartikel Perak dengan Metode Reduksi dan Aplikasinya Sebagai Antibakteri Penyebab Luka Infeksi;HA Ariyanta;Media Kesehatan Masyarakat Indonesia;10 (1), 36-42;22;2016;10865776715618340307;z0_F5_TITjQC;xmJJ9Y0AAAAJ
15;Project based learning (pbl) to improve psychomotoric skills: a classroom action research;W Sumarni, S Wardani, S Sudarmin, DN Gupitasari;Jurnal Pendidikan IPA Indonesia;5 (2), 157-163;20;2016;10163538444457422179;G-26V_K0F8UC;xmJJ9Y0AAAAJ
16;Pengaruh motivasi terhadap minat mahasiswa akuntansi untuk mengikuti pendidikan profesi akuntansi (ppak);S Wahyuni, R Natariasari;Jurnal Online Mahasiswa (JOM) Bidang Ilmu Ekonomi;1 (1), 1-15;20;2014;1974872838352093747;D8wXzuvKacYC;xmJJ9Y0AAAAJ
17;The impact of product quality, price and distribution on purchasing decision on the Astra motor products in Jakarta;S Wahyuni, M Ginting;Arthatama Journal of Business Management and Accounting;1 (1), 18-26;19;2017;1719337236199448558;As9-p0eyQpQC;xmJJ9Y0AAAAJ
18;Analisis Balanced Scorecard Sebagai Alat Pengukuran Kinerja pada PT Semen Bosowa Maros;S Wahyuni;Universitas hasanuddin makasar: Skripsi jurusan akuntansi. Fakultas ekonomi;;19;2011;13889849696293358507;MKvDIwB-zewC;xmJJ9Y0AAAAJ
19;Asuhan Keperawatan Pada Klien Dengan Masalah Psikososial dan Gangguan Jiwa;J Purba, S Wahyuni, M Nasution, W Daulay;Medan: USU Press;;19;2008;4762274420470021822;T0nwzvlCxs8C;xmJJ9Y0AAAAJ
20;Pengembangan Lembar Kerja Siswa (LKS) Berbasis Keterampilan Proses di SMAN 4 Jember;R Anggraini, S Wahyuni, AD Lesmono;Jurnal Pembelajaran Fisika;4 (4), 350-365;18;2016;11414789364971752212;jkTRWqoJ8oAC;xmJJ9Y0AAAAJ
21;L2 speaking strategies employed by Indonesian EFL tertiary students across proficiency and gender;S Wahyuni;University of Canberra;;18;2013;4387628832644286247;ve7iT2ZEuL4C;xmJJ9Y0AAAAJ
22;Pengembangan Bahan Ajar Fisika Berupa Komik Pada Materi Cahaya di SMP;RDN Alfiana;;;18;2012;17690240509944949973;nPT8s1NX_-sC;xmJJ9Y0AAAAJ
23;Women's decision-making role in small ruminant production: The conflicting views of husbands and wives;S Wahyuni, HC Knipscheer, M Gaylord;Agricultural Administration and Extension;24 (2), 91-98;18;1987;13676761696445858042;5N-NJrZHaHcC;xmJJ9Y0AAAAJ
24;A. Latar Belakang Masalah;I BAB;;;17;2012;14405123882340109010,4362162531236998811,717742696229454209,9721855875673236339,6017776185007177128,234485836647475540,3576694688109146538,16299555960541741706,4436351355094480708,4849978881900021591,13130043175292449225,5525367439863728226;v1_lew4L6wgC;xmJJ9Y0AAAAJ
25;Menumbuhkembangkan minat baca menuju masyarakat literat;S Wahyuni;Diksi;16 (2);17;2009;7270429110221263522;hEXC_dOfxuUC;xmJJ9Y0AAAAJ
26;Analisis Perbandingan Bentuk Jaringan Pembuluh Trakea pada Preparat Maserasi Berbagai Genus Piper Sebagai Sumber Belajar Biologi;F Kurniawati;University of Muhammadiyah Malang;;16;2013;15399050057298172533,964685302268475158,11726301558649716338,13333779939503447493,12574679522894873479,4886935253441535120,14450380010299421386;bKqednn6t2AC;xmJJ9Y0AAAAJ
27;Analisis Kandungan Informasi Laporan Arus Kas di Bursa Efek Jakarta;S Wahyuni;Journal of Indonesian Economy and Business;17 (2);16;2002;12468928975015393196;xXdmTUQ9lisC;xmJJ9Y0AAAAJ
28;Pengembangan bahan Ajar IPA untuk meningkatkan kemampuan berpikir kritis siswa SMP;S Wahyuni;PROSIDING: Seminar Nasional Fisika dan Pendidikan Fisika;6 (6);15;2015;9856579663751133902;QYmifXMdJWgC;xmJJ9Y0AAAAJ
29;Pengembangan petunjuk praktikum IPA untuk meningkatkan kemampuan berpikir kritis siswa SMP;S Wahyuni;;;14;2015;1785576919873577529;fMcxjvj1mj8C;xmJJ9Y0AAAAJ
30;Seri tumbuhan obat berpotensi hias;S Andalusia, S Wahyuni;Elex Media Komputindo;;14;2013;1328204823623125127;0xcHesCNKywC;xmJJ9Y0AAAAJ
31;Karakterisasi dan uji aktivitas bakteri rizosfer lahan ultisol sebagai pemacu pertumbuhan tanaman dan agensia hayati cendawan patogen tular tanah secara in vitro;A Khaeruni, GAK Sutariati, S Wahyuni;Jurnal Hama dan Penyakit Tumbuhan Tropika;10 (2), 123-130;14;2011;7786744748647694669;9w-KRoa3VEQC;xmJJ9Y0AAAAJ
32;Utilizing of Comic and Jember's Local Wisdom as Integrated Science Learning Materials;AA Kurniawati, S Wahyuni, PDA Putra;International Journal of Social Science and Humanity;7 (1), 47;13;2017;4991386060486513927;djcsc3XHdKAC;xmJJ9Y0AAAAJ
33;The estimation of combining ability and heterosis effect for yield and yield components in tomato (Lycopersicon esculentum Mill.) at lowland;SI Aisya, S Wahyuni, M Syukur, JR Witono;Ekin Journal of crop breeding and genetics;2 (1), 23-29;13;2016;7127712531148438643;654Jc7Ppz2kC;xmJJ9Y0AAAAJ
34;Faktor internal dan eksternal yang mempengaruhi depresi postpartum;S Wahyuni, M Murwati, S Supiati;Interest: Jurnal Ilmu Kesehatan;3 (2);12;2014;10834256575315339189;URolC5Kub84C;xmJJ9Y0AAAAJ
35;Hubungan Efikasi Diri dan Regulasi Emosi dengan Motivasi Berprestasi pada Siswa SMK Negeri 1 Samarinda;S Wahyuni;dalam Jurnal Psikologi;1 (1), 88-95;12;2013;14569678359905013043;Y9VhQm-5nPIC;xmJJ9Y0AAAAJ
36;Pengembangan Petunjuk Praktikum Fisika Berbasis Laboratorium Virtual (Virtual Laboratory) pada Pembelajaran Fisika di SMP/MTs;S Fitriya, AD Lesmono, AM Si, S Wahyuni;UNEJ;;12;2013;3359839297921890068;rLGzs9wiiwIC;xmJJ9Y0AAAAJ
37;Abd;S Wahyuni;Syukur Ibrahim;;12;2012;4558817570952662644;GYFkgKAhzLcC;xmJJ9Y0AAAAJ
38;A potential retardant for lodging resistance in direct seeded rice (Oryza sativa L.);U Rani Sinniah, S Wahyuni, BSA Syahputra, S Gantait;Canadian journal of plant science;92 (1), 13-18;12;2012;11961468934936149670;3fE2CSJIrl8C;xmJJ9Y0AAAAJ
39;Kompos Bio Organik Tandan Kosong Kelapa Sawit;PPK Sawit;Pusat Penelitian Kelapa Sawit. Medan;;12;2008;18388906943846666346;vct99db0rDQC;xmJJ9Y0AAAAJ
40;Design and implementation of schoology-based blended learning media for basic physics I course;W Suana, N Maharta, IDP Nyeneng, S Wahyuni;Jurnal Pendidikan IPA Indonesia;6 (1);11;2017;9896094189249358808,2709481131104018066;-fj4grS0xi0C;xmJJ9Y0AAAAJ
41;Pengelompokan kultivar ketumbar berdasar sifat morfologi;E Hadipoentyanti, S Wahyuni;Buletin Plasma Nutfah;10 (1), 32-36;11;2017;17713334977030137256;iWMDS-dds2cC;xmJJ9Y0AAAAJ
42;Improvement of seedling establishment of wet seeded rice using GA3 and IBA as seed treatment;S Wahyuni, UR Sinniah, MK Yusop, R Amarthalingam;Indonesian Journal of Agricultural Science;4 (2), 56-62;11;2016;15363821027575309740;tvutLEwYQz8C;xmJJ9Y0AAAAJ
43;Mukarlina & Yanti, HA, 2014,’Aktivitas Antifungi Ekstrak Metanol Daun Buas-Buas (Premna serratifolia) Terhadap Jamur Diplodia sp;S Wahyuni;Pada Jeruk Siam (Citrus nobilis var. microcarpa)’Protobiont;3 (2), 274-279;11;2015;18044748598401374911;bzhzIcV5SW4C;xmJJ9Y0AAAAJ
44;DEVELOPING SCIENCE LEARNING INSTRUMENTS BASED ON LOCAL WISDOM TO IMPROVE STUDENTS’CRITICAL THINKING SKILLS;S Wahyuni;;;11;2015;1848315318738059444;gL9scSG3K_gC;xmJJ9Y0AAAAJ
45;Justidrusamides A–D, new 2-aminobenzyl alcohol derivatives from Justicia gendarussa;Y Kiren, J Deguchi, Y Hirasawa, H Morita, B Prajogo;Journal of natural medicines;68 (4), 754-758;11;2014;6468037548395932712;U_HPUtbDl20C;xmJJ9Y0AAAAJ
46;Faktor-faktor yang Berhubungan dengan Penyakit Diabetes Melitus (DM) Daerah Perkotaan di Indonesia Tahun 2007 (Analisis Data sekunder Riskesdas 2007);S Wahyuni;Skripsi UIN: Jakarta;;11;2010;3646268155182438811;BHd7YmozNHgC;xmJJ9Y0AAAAJ
47;Identifikasi galur tetua padi hibrida dengan marka SSR spesifik dan pemanfaatannya dalam uji kemurnian benih;IW Mulsanti, M Surahman, S Wahyuni, DW Utami;Pusat Penelitian dan Pengembangan Tanaman Pangan;;10;2015;15679882348658844937;yqoGN6RLRZoC;xmJJ9Y0AAAAJ
48;Pengaruh Model Pembelajaran Probing-Prompting Berbantuan Lembar Kerja Berstruktur Terhadap Hasil Belajar;A Diasputri, S Nurhayati, W Sugiyo;Jurnal Inovasi Pendidikan Kimia;7 (1);10;2013;13352022651640986122;QbuKDewGlxwC;xmJJ9Y0AAAAJ
49;Penerapan Model Pembelajaran Kooperatif Tipe STAD Berbasis Multimedia Audio Visual dalam Pembelajaran Fisika di SMP;DQ A’yun, T Prihandono, S Wahyuni;;;10;2012;15495407547629993936;PpfTWA6RG0gC;xmJJ9Y0AAAAJ
50;Iluminasi Naskah Cirebon;AO Safari;Manuskripta;1 (2), 43-58;10;2011;15250818488153630175,7892468899702039304,4915038563572692461,2058521777912802565,17552479683505365852,5909685239813541882;hXkWDDAEazwC;xmJJ9Y0AAAAJ
51;Efek Pemberian Ransum yang Mengandung Tepung Daun Singkong, Daun Ubi Jalar dan Eceng Gondok sebagai Sumber Pigmen Karotenoid Terhadap Kualitas Kuning Telur Itik Tegal (The …;E Sujana, S Wahyuni, H Burhanuddin;Jurnal Ilmu Ternak;6 (1);10;2006;17644359335660766470;3I1Fh14WnZcC;xmJJ9Y0AAAAJ
52;Kontroversi Perkawinan Beda Agama di Indonesia;S Wahyuni;Jurnal Hukum Islam;;9;2016;15525945295114583046,7596472037463149579;JoZmwDi-zQgC;xmJJ9Y0AAAAJ
53;Deactivation and regeneration of Ni/ZA catalyst in hydrocracking of polypropylene;I Khabib, S Kadarwati, S Wahyuni;Indonesian Journal of Chemistry;14 (2), 192-198;9;2014;17868670019535829459;69ZgNCALVd0C;xmJJ9Y0AAAAJ
54;Optimalisasi Zeolit Alam Wonosari dengan Proses Aktivasi secara Fisis dan Kimia;PA Anggara, S Wahyuni, AT Prasetya;Indonesian Journal of Chemical Science;2 (1);9;2013;8461113649319497389;NxmKEeNBbOMC;xmJJ9Y0AAAAJ
55;Analisis pengaruh kualitas layanan internet banking dan tingkat kepuasan terhadap loyalitas nasabah pada PT Bank Rakyat Indonesia (Persero) Tbk kantor cabang pembantu Jamsostek …;AN Huda, S Wahyuni;Business and Management Review;2 (2);9;2013;1215716870742104331;8RAEygVn5_EC;xmJJ9Y0AAAAJ
56;Psikologi keperawatan;S Zulfan, S Wahyuni;Jakarta: PT. Raja Grafindo persada;;9;2012;9726347180585270102;LTdYzzxxQecC;xmJJ9Y0AAAAJ
57;Analisis Balanced Scorecard sebagai alat Pengukuran kinerja pada PT;S Wahyuni;Semen Bosowa Maros. Skripsi Fakultas Ekonomi Universitas Hassanudin;;9;2011;13371341198282716614;hx4mni8B3JkC;xmJJ9Y0AAAAJ
58;Spektroskopi inframerah senyawa kalsium fosfat hasil presipitasi;DS Soejoko, S Wahyuni;Makara Journal of Science;;9;2010;3589762253676462594;Hck25ST_3aIC;xmJJ9Y0AAAAJ
59;Pengembangan Model Asesmen Otentik dalam Pembelajaran Keterampilan Berbahasa Indonesia Lisan di Sekolah Menengah Atas (SMA);S Wahyuni;LITERA;9 (1);9;2010;3349200794215762784;7PzlFSSx8tAC;xmJJ9Y0AAAAJ
60;Diabetes Mellitus pada Perempuan Usia Reproduksi di Indonesia Tahun 2007;S Wahyuni, RN Alkaff;Indonesian Journal of Reproductive Health;3 (1), 46-51;9;2007;6559772568310621983;-uzm3Y7AvW0C;xmJJ9Y0AAAAJ
61;Skrining ISSR Primer Studi Pendahuluan Kekerabatan Antar Jahe Merah, Jahe Emprit dan Jahe Besar;S Wahyuni, DH Xu, N Bermawie, H Tsunematsu, T Ban;Pusat Penelitian dan Pengembangan Perkebunan;;9;2004;9658414357937034624;tOudhMTPpwUC;xmJJ9Y0AAAAJ
62;Profil penderita diare anak di puskesmas rawat inap pekanbaru;E Maryanti, SD Lesmana, H Mandela, S Herlina;Jurnal Ilmu Kedokteran;8 (2), 101-105;8;2017;10951177194701157549;rOcdG6UcVlcC;xmJJ9Y0AAAAJ
63;Developing science process skills and problem solving abilities based on outdoor learning in junior high school;S Wahyuni, I Indrawati, S Sudarti, W Suana;Jurnal Pendidikan IPA Indonesia;6 (1);8;2017;8006005893575668716;Xnn2mF3JXD4C;xmJJ9Y0AAAAJ
64;Integrasi kelembagaan Forum KASS dan program agropolitan dalam rangka pengembangan agribisnis sayuran Sumatera;SK Dermoredjo, S Wahyuni, E Ariningsih, V Darwis;Analisis Kebijakan Pertanian;2 (3), 257-276;8;2017;2110395667988048240;2C0LhDdYSbcC;xmJJ9Y0AAAAJ
65;Synthesis CuO-ZnO nanocomposite and its application as an antibacterial agent;N Widiarti, JK Sae, S Wahyuni;IOP Conference Series: Materials Science and Engineering;172 (1), 012036;8;2017;687266873280957810;bgW0xdllhO4C;xmJJ9Y0AAAAJ
66;Purification and Characterization of Thermostable Chitinase from Bacillus SW41 for Chitin Oligomer Production.;S Wahyuni, MT Suhartono, A Khaeruni, AS Purnomo, PA Riupassa;Asian Journal of Chemistry;28 (12);8;2016;7946372050660614311;Lpa4s8qvUTIC;xmJJ9Y0AAAAJ
67;Dinamika program dan kebijakan peningkatan produksi padi;S Wahyuni, KS Indraningsih;Pusat Sosial Ekonomi dan Kebijakan Pertanian;;8;2016;16371566487211932036;dBzKUGQurMsC;xmJJ9Y0AAAAJ
68;Buku Petunjuk Praktikum Mikroteknik;S Wahyuni;Malang: Laboratorium Biologi Universitas Muhammadiyah Malang;;8;2015;12638819412484619784;OWslULmvb_UC;xmJJ9Y0AAAAJ
69;Asesmen pembelajaran bahasa;AS Ibrahim, S Wahyuni;Bandung: PT Reika Aditama;;8;2012;7628942645208781479;7_FrD3gH8REC;xmJJ9Y0AAAAJ
70;Sistem Pendukung Keputusan Model Fuzzy AHP Dalam Pemilihan Kualitas Perdagangan Batu Mulia;S Wahyuni, S Hartati;IJCCS (Indonesian Journal of Computing and Cybernetics Systems);6 (1);8;2012;12905731797969941484;F9fV5C73w3QC;xmJJ9Y0AAAAJ
71;Analisis Kelayakan Pengembangan Biogas Sebagai Energi Alternatif Berbasis Individu dan Kelompok Peternak;S Wahyuni, A Saleh;MANAJEMEN IKM: Jurnal Manajemen Pengembangan Industri Kecil Menengah;4 (2 …;8;2011;1163883545585610730;s-mE-ZzancgC;xmJJ9Y0AAAAJ
72;Eksperimentasi model pembelajaran berdasarkan masalah Pada sub pokok bahasan sistem persamaan linear dua Variabel ditinjau dari aktivitas belajar siswa kelas x smk Se-kabupaten …;S Wahyuni;Universtas Sebelas Maret;;8;2009;10024681013874425885;W7OEmFMy1HYC;xmJJ9Y0AAAAJ
73;Kamus Besar Bahasa Indonesia;S Wahyuni;Jakarta, Pustaka Phoenix;;8;2007;14262210917517709393;rjBKtydo3wgC;xmJJ9Y0AAAAJ
74;Spot survey reservoir leptospirosis di desa bakung, kecamatan jogonalan, kabupaten klaten, jawa tengah;R Ristiyanto, DH Farida, G Gambiro, S Wahyuni;Indonesian Bulletin of Health Research;34 (3);8;2006;3235287885116834673;X-Dm1JipzzIC;xmJJ9Y0AAAAJ
75;Fihrin, dan Muslimin. 2015. Efektivitas Model Pembelajaran Kooperatif Tipe Group Investigation terhadap Hasil Belajar Fisika pada Siswa Kelas XI MA Alkhairaat Kalangkangan;D Wahyuni;Journal Pendidikan Fisika Tadulako (JPFT);2 (1), 33-3;8;#N/A;11325766368054157510,16111687635924462906;OYCXtYc4maoC;xmJJ9Y0AAAAJ
76;Pengaruh Mekanisme Good Corporate Governance (GCG) dan Ukuran Perusahaan Terhadap Kualitas Pengungkapan Sustainability Report Pada Perusahaan Terdaftar Di BEI;D Aliniar, S Wahyuni;Kompartemen: Jurnal Ilmiah Akuntansi;15 (1);7;2017;5896220299098061447;aSKcRT6rTsQC;xmJJ9Y0AAAAJ
77;Pengembangan Modul IPA Berbasis Kearifan Lokal Daerah Pesisir Puger Pada Pokok Bahasan Sistem Transportasi Di SMP;A Saputra, S Wahyuni;Jurnal Pembelajaran Fisika;5 (2), 182-189;7;2017;6026728142850270633;WD7AgJrCjNIC;xmJJ9Y0AAAAJ
78;Determining proportion of exfoliative vaginal cell during various stages of estrus cycle using vaginal cytology techniques in aceh cattle;TN Siregar, J Melia, CN Thasmi, D Masyitha, S Wahyuni, J Rosa, ...;Veterinary medicine international;2016;7;2016;9521256372544103847;FwTEoIZreccC;xmJJ9Y0AAAAJ
79;Statistical models for chili productivity;H Wijayanto, IM Sumertajaya, A Fitrianto, S Wahyuni;Applied Mathematical Sciences;8 (2), 69-79;7;2014;7263569401289112144;feST4K8J0scC;xmJJ9Y0AAAAJ
80;Utilization of chitinolytic bacterial isolates to control anthracnose of cocoa leaf caused by Colletotrichum gloeosporioides;D Suryanto, S Wahyuni, EBM Siregar, E Munir;African Journal of Biotechnology;13 (15);7;2014;9642798496779479827;ijdKiLOsEJMC;xmJJ9Y0AAAAJ
81;Elektrodegradasi Indigosol Golden Yellow IRK dalam Limbah Batik dengan Elektroda Grafit;S Nugroho;Universitas Negeri Semarang;;7;2013;2196560826462466583;DkZNVXde3BIC;xmJJ9Y0AAAAJ
82;Hubungan Konsumsi Fast Food Dengan Obesitas Pada Remaja di Akademi Kebidanan Muhammadiyah Banda Aceh;S Wahyuni, A Ahmad;Skripsi. Sekolah Tinggi Ilmu Kesehatan U'Budiyah: Banda Aceh;;7;2013;8169478854580670504;qu5FZ_za5owC;xmJJ9Y0AAAAJ
83;Strategi Percepatan Transformasi Kelembagaan Gapoktan dan Lembaga Keuangan Mikro Agribisnis Dalam Memperkuat Ekonomi di Perdesaan;S Saptana, S Wahyuni, SM Pasaribu;Jurnal Manajemen & Agribisnis;10 (1), 60-70;7;2013;4508926816748619773;Fr8DH2VBP9sC;xmJJ9Y0AAAAJ
84;Pelaksanaan Sistem Pengendalian Intern Terhadap Prosedur Penerimaan dan Pengeluaran Barang Pada UD. Dwi Jaya Sentosa Surabaya;S Wahyuni;Jurnal Ilmu & Riset Akuntansi;2 (3), 1-23;7;2013;7564742188139617674,6033645589428236025;iKswqCX-FLkC;xmJJ9Y0AAAAJ
85;Reminder Effect and Anchoring-adjustment in Earnings Announcement: Implementation of Priorperiod Benchmark Disclosure Strategy;S Wahyuni, HM Jogiyanto;Journal of Indonesian Economy and Business;27 (3), 390-405;7;2012;857362468800451429;tHtfpZlB6tUC;xmJJ9Y0AAAAJ
86;Sintesis dan Karakterisasi Nanokatalis CuO/TiO2 yang Diaplikasikan pada Proses Degradasi Limbah Fenol;MW Lestari;Universitas Negeri Semarang;;7;2012;17761905597668205147;AZju0d2GQJ0C;xmJJ9Y0AAAAJ
87;Analisis Efektifitas Zona Selamat Sekolah (ZoSS) di Sekolah Dasar Kota Pekanbaru;S Wahyuni;Retrieved: April;3, 2016;7;2012;1888709056437302846;mVmsd5A6BfQC;xmJJ9Y0AAAAJ
88;Adsorpsi Ion Logam Zn (II) pada Zeolit A yang disintesis dari Abu Dasar Batubara PT IPMOMI PAITON dengan Metode Batch;S Wahyuni, N Widiastuti;Prosiding Tugas Akhir Semester Ganjil;2009/2010;7;2009;7862332899327720540;ZjmTu7HDCaEC;xmJJ9Y0AAAAJ
89;Biokonversi Dedak Padi oleh Kapang Aspergillus vicuum sebagai Upaya Menurunkan Kadar Fitat dan Pengaruhnya terhadap Kinerja Ayam Petelur;HS Siti Wahyuni;Disertasi. Program Pascasarjana, Institut Pertanian Bogor;41;7;1995;11489737394649781833;6syOTa9L3GQC;xmJJ9Y0AAAAJ
90;Brand religiosity aura and brand loyalty in Indonesia Islamic banking;S Wahyuni, N Fitriani;Journal of Islamic Marketing;8 (3), 361-372;6;2017;9507605262309455436;NWFKKQzSIN4C;xmJJ9Y0AAAAJ
91;An Analysis On Writing Anxiety Of Indonesian Efl College Learners;S Wahyuni, MK Umam;JEELS (Journal of English Education and Linguistics Studies);4 (1), 105-128;6;2017;12160891997334994142;vlECJaBXBlQC;xmJJ9Y0AAAAJ
92;Nikah Beda Agama: Kenapa ke Luar Negeri?;S Wahyuni, M Ag, M Hum;Pustaka Alvabet;;6;2017;902064401211834723;W91e3rS6dHEC;xmJJ9Y0AAAAJ
93;Pengembangan Media Pembelajaran Video Tutorial Facebokk Untuk Meningkatkan Hasil Belajar Siswa Pada Mata Pelajaran Pemasaran Online Di Smk Negeri 3 Surakarta;DH Kusuma, S Wahyuni, L Noviani;Prosiding Seminar Pendidikan Ekonomi dan Bisnis;1 (1);6;2015;11390157383377414938;1_W9tMSvGuwC;xmJJ9Y0AAAAJ
94;Hasil Padi dari empat kelas benih yang berbeda;IW Mulsanti, S Wahyuni, H Sembiring;Jurnal Penelitian Pertanian Tanaman Pangan;33 (3), 169-176;6;2014;5771776345078568411;8NHCvSvNRCIC;xmJJ9Y0AAAAJ
95;Analisis Faktor-Faktor Yang Mempengaruhi Peringkat Obligasi Syariah: Studi Empiris Pada Pasar Obligasi Syariah Di Indonesia;A Kusbandiyah, S Wahyuni;Universitas Muhammadiyah Surakarta;;6;2014;3635023487321082855;LGlY6t8CeOMC;xmJJ9Y0AAAAJ
96;Two novel tetracycles, cassibiphenols A and B from the flowers of Cassia siamea;J Deguchi, T Sasaki, Y Hirasawa, T Kaneda, I Kusumawati, O Shirota, ...;Tetrahedron Letters;55 (7), 1362-1365;6;2014;4988724266345933179;NDuN12AVoxsC;xmJJ9Y0AAAAJ
97;Perkawinan beda agama di luar negeri: kajian filosofis, yuridis, prosedural, dan sosiologis;S Wahyuni;SUKA-Press;;6;2014;10959304776672949453;SgTKrLvt1DcC;xmJJ9Y0AAAAJ
98;Uji Manfaat Daun Kelor (Moringa aloifera Lamk) Untuk Mengobati Penyakit Hepatitis B;S Wahyuni, MA Asrikan, MCU Sabana, SWN Sahara, T Murtiningsih, ...;Jurnal Kesehatan Kusuma Husada;;6;2013;8320174669258381037;kzcrU_BdoSEC;xmJJ9Y0AAAAJ
99;Proses Komunikasi dan Partisipasi dalam Pembangunan Masyarakat Desa (Kasus Program Raksa Desa di Kecamatan Ciampea Kabupaten Bogor);S Wahyuni;Tesis;2;6;2012;5427892407285597243,18071631990779215642;kNdYIx-mwKoC;xmJJ9Y0AAAAJ
100;Histologi dan histomorfometri testis dan epididimis muncak (Muntiacus muntjak muntjak) pada periode ranggah keras;S Wahyuni, S Agungpriyono, M Agil, TL Yusuf;J. Vet;13 (3), 211-219;6;2012;5612217912917223112;G60ApcfeQaAC;xmJJ9Y0AAAAJ
101;Persepsi perawat tentang perilaku kekerasan yang dilakukan pasien di ruang rawat inap jiwa;V Elita;Jurnal Ners Indonesia;1 (2), 31-40;6;2011;1261008517441957100;Fp1gVP7Oym8C;xmJJ9Y0AAAAJ
102;Terapi Tertawa dan Kecemasan Mahasiswa Program Ekstensi Dalam Menghadapi Skripsi Di Fakultas Keperawatan USU;WS Mathofani, SE Wahyuni;Jurnal Keperawatan Usu.(diunduh tanggal;29 januari 2014);6;2011;1447113997482019967;3z7foVzkq2cC;xmJJ9Y0AAAAJ
103;Pengaruh cognitive behaviour therapy terhadap halusinasi pasien di Rumah Sakit Jiwa Pempropsu Medan;SE Wahyuni;Tesis FIK-UI. Tidak dipublikasikan;;6;2010;14950476968470009310;q3SxJD15z-gC;xmJJ9Y0AAAAJ
104;Peluang budidaya dan manfaat jintan hitam (Nigella sativa L.);S Wahyuni;Warta Penelitian dan Pengembangan Tanaman Industri;15 (1), 23-25;6;2009;14520633027172155676;PbVfkCSoiPoC;xmJJ9Y0AAAAJ
105;Analisa kelayakan pengembangan biogas sebagai energi alternatif berbasis individu dan kelompok;S Wahyuni;Tesis Sekolah Pasca Sarjana. Institut Pertanian Bogor: Bogor;;6;2008;14311994890528283706;rt-opDMcQ_cC;xmJJ9Y0AAAAJ
106;Hubungan Antara Pengetahuan Ibu Hamil Tentang Gizi Dengan Status Gizi Ibu Hamil Di Puskesmas Nusukan Surakarta;S Wahyuni;Fakultas Kedokteran Universitas Sebelas Maret. KTI;;6;2008;4643449400766760372;qLQjcG-1Y3AC;xmJJ9Y0AAAAJ
107;Nursalam. 2007;RT Setiyono, D Manohara, S Wahyuni;Ketahanan lada hibrida LH;4-5;6;2004;12633053738904655283;gmhHX4scLhsC;xmJJ9Y0AAAAJ
108;Keanekaragaman suku dan budaya di Aceh;R Sufi, R Sufi, S Wahyuni;Balai Kajian Sejarah dan Nilai Tradisional Banda Aceh;;6;2004;8261912393511363735;r5yabEp13iMC;xmJJ9Y0AAAAJ
109;Darah dan jiwa Aceh: Mengungkap falsafah hidup masyarakat Aceh;M Umar, Sudirman, S Wahyuni;Yayasan Busafat: Dinas Kebudayaan Provinsi Nanggroe Aceh Darussalam;;6;2002;9302371321594595987;eH23hyXCXa4C;xmJJ9Y0AAAAJ
110;4.1 Hasil Penelitian;IV BAB;Sumber;25 (80), 41-93;6;1978;7193804318305213004,15328117251203636137,4068775998687658036;KbBQZpvPDL4C;xmJJ9Y0AAAAJ
111;Investigation on the Deoxygenation rate of water of Cimanuk River indramayu Indonesia;YM Yustiani, S Wahyuni, MR Alfian;Rasayan J. Chem;11 (2), 475-481;5;2018;17817808463275061741;viYOxJONeN0C;xmJJ9Y0AAAAJ
112;Pengembangan Modul Pembelajaran Berbasis Multirepresentasi pada Pembelajaran Fisika di SMA/MA;TA Setyandaru, S Wahyuni, PD aristya Putra;Jurnal Pembelajaran Fisika;6 (3), 223-230;5;2017;4718502788977245609;RL3Vt95MvH0C;xmJJ9Y0AAAAJ
113;Pengembangan Modul IPA Tematik Berbasis Etnosains Kabupaten Jember Pada Tema Budidaya Tanaman Tembakau Di SMP;MR Nailiyah, S Subiki, S Wahyuni;Jurnal Pembelajaran Fisika;5 (3), 261-269;5;2016;17417287089258484832;q1ZQJjUA47MC;xmJJ9Y0AAAAJ
114;KONSEP NUSYU< Z DAN KEKERASAN TERHADAP ISTERI: Perbandingan Hukum Positif dan Fiqh;S Wahyuni;al-Ahwal: Jurnal Hukum Keluarga Islam;1 (1), 17-30;5;2016;15914107704991410313;ruyezt5ZtCIC;xmJJ9Y0AAAAJ
115;Keanekaragaman Makrofauna Tanah Di Kawasan Perkebunan Coklat (Theobroma Cacao L.) Sebagai Bioindikator Kesuburan Tanah Dan Sumber Belajar Biologi;E Nurrohman, A Rahardjanto, S Wahyuni;Jurnal Pendidikan Biologi Indonesia;1 (2);5;2016;2082742714938543736;gUOu-QWEMMQC;xmJJ9Y0AAAAJ
116;Pengembangan media flash flipbook untuk meningkatkan keterampilan berfikir kreatif siswa dalam pembelajaran IPA di SMP;DU Mulyadi, S Wahyuni;Jurnal Pembelajaran Fisika;4 (4), 296-301;5;2016;7233515611851544326;K-tzbvM8PMoC;xmJJ9Y0AAAAJ
117;Pengembangan media pembelajaran berbasis komik dalam materi sistem pernapasan pada siswa kelas VIII MTs Muhammadiyah 1 malang;IFZ Utariyanti, S Wahyuni, S Zaenab;Jurnal Pendidikan Biologi Indonesia;1 (3);5;2016;13936377901432244950;H30kdXGRGPkC;xmJJ9Y0AAAAJ
118;Pengaruh CAR, NPF, FDR dan BOPO Terhadap Profitabilitas Bank Umum Syariah (Periode 2011-2015);S Wahyuni;Fakultas Syariah dan Hukum UIN Syarif Hidayatullah Jakarta;;5;2016;12614988548340641931;BSZS1fLCB98C;xmJJ9Y0AAAAJ
