no;title;author;journal;number;cites;year;cid;pubid;id
680;Karakterisasi Morfologi Daun Begonia Alam (Begoniaceae): Prospek Pengembangan Koleksi Tanaman Hias Daun di Kebun Raya Indonesia;HM Siregar, S Wahyuni, IM Ardaka;Jurnal Biologi Indonesia;14 (2);0;2019;#N/A;vQKLzKM0twkC;xmJJ9Y0AAAAJ
681;Pemahaman Guru Tentang Pembelajaran Bahasa Arab Dan Implementasinya Di Mts As’ adiyah Putri Pusat Sengkang;S Wahyuni;Murabbi;2 (1);0;2019;#N/A;TXeVt8n0jncC;xmJJ9Y0AAAAJ
682;HUBUNGAN POLA ASUH ORANG TUA DENGAN PERKEMBANGAN MORAL ANAK DI SD N 3 BUNTALAN KLATEN TENGAH, KLATEN;PD Wintoro, S Wahyuni;INVOLUSI Jurnal Ilmu Kebidanan (Journal of Midwifery Science);9 (17);0;2019;#N/A;cInq4TRmCz8C;xmJJ9Y0AAAAJ
683;DETERMINAN FERTILITAS DI INDONESIA HASIL SDKI 2017;YA Jatmiko, S Wahyuni;Euclid;6 (1), 95-106;0;2019;#N/A;dyGod8kC9dQC;xmJJ9Y0AAAAJ
684;Analisis Pariwisata Budaya dalam Pengembangan Aset Lokal Perayaan Upacara Adat Dahau di Kabupaten Kutai Barat Provinsi Kalimantan Timur;S Wahyuni;Jurnal Manajemen Aset Infrastruktur & Fasilitas;3 (1);0;2019;#N/A;yG35QFzCZWcC;xmJJ9Y0AAAAJ
685;STUDI ANALISIS KUALITAS AIR SUNGAI CIBANTEN KABUPATEN SERANG PROVINSI BANTEN;YM Yustiani, S Wahyuni, A Saputra;Journal of Community Based Environmental Engineering and Management;2 (1), 13-20;0;2019;#N/A;yyP9NS4UN-AC;xmJJ9Y0AAAAJ
686;PERENCANAAN SISTEM PENYEDIAAN AIR MINUM DALAM RANGKA PENINGKATAN PELAYANAN DI WILAYAH IKK LEUWIMUNDING, PALASAH, SUMBERJAYA KABUPATEN MAJALENGKA;E Afiatun, S Wahyuni, RD Taruna;Journal of Community Based Environmental Engineering and Management;2 (1), 30-36;0;2019;#N/A;lZkERF9nS_wC;xmJJ9Y0AAAAJ
687;STRATEGI OPTIMASI PEMANFAATAN SUMBER AIR BANTAR AWI SUNGAI CIKAPUNDUNG TERHADAP INSTALASI PENGOLAHAN AIR MINUM DAGO PAKAR;E Afiatun, S Wahyuni, S Merinda;Journal of Community Based Environmental Engineering and Management;2 (2), 51-60;0;2019;#N/A;nS6_t4fuB3kC;xmJJ9Y0AAAAJ
688;Pengaruh Model Pembelajaran Project Based Learning Terhadap Kemampuan Pemahaman Konsep Mahasiswa Mata Kuliah Kapita Selekta Matematika Pendidikan Dasar FKIP UMSU;S Wahyuni;EduTech: Jurnal Ilmu Pendidikan dan Ilmu Sosial;5 (1);0;2019;#N/A;H1wcazwC3NUC;xmJJ9Y0AAAAJ
689;ANALISIS TINGKAT KEBISINGAN LALU LINTAS DI JALAN CIHAMPELAS DAN JALAN SUKAJADI KOTA BANDUNG;S Wahyuni, YM Yustiani, A Juliandahri;Journal of Community Based Environmental Engineering and Management;2 (1), 9-12;0;2019;#N/A;voxG-9qLvA4C;xmJJ9Y0AAAAJ
690;PERBANDINGAN KOMPOSISI KOAGULAN BIJI KELOR (MoringanOleifera), BIJI ASAM JAWA (TamarindusIndica L) DAN ALUMINIUM SULFAT (AL2 (SO4) 3) UNTUK MENURUNKAN KEKERUHAN AIR SUNGAI …;E Afiatun, S Wahyuni, F Hamdan;Journal of Community Based Environmental Engineering and Management;2 (1), 21-30;0;2019;#N/A;A36e8EsbUSoC;xmJJ9Y0AAAAJ
691;PERENCANAAN SARANA PENGOLAHAN AIR LIMBAH DOMESTIK BERBASIS MASYARAKAT DI DAERAH PESISIR (STUDI KASUS: DESA PURWOREJO, KECAMATAN BONANG, KABUPATEN DEMAK);S Wahyuni, L Mulyatna, L Qomariyah;Journal of Community Based Environmental Engineering and Management;2 (2), 43-50;0;2019;#N/A;jMMVlDWEh88C;xmJJ9Y0AAAAJ
692;Physics vs Mathematics teacher candidates’ grit trait level: A case study of Universitas Negeri Semarang undergraduate students;S Sugiyanto, W Hardyanto, A Rusilowati, SE Nugroho, KI Supardi, ...;Journal of Physics: Conference Series;1170 (1), 012043;0;2019;#N/A;6zSeHT1sY2IC;xmJJ9Y0AAAAJ
693;The Analysis of Micro, Small, and Medium Enterprises (MSMEs) development through external facilitation and internal potential on former workers of Sigaret Kretek Tangan (SKT …;J Widodo, S Wahyuni, M Zulianto, NN Islami;IOP Conference Series: Earth and Environmental Science;243 (1), 012092;0;2019;#N/A;R4LAE1HziJcC;xmJJ9Y0AAAAJ
694;Study on fluctuation of water consumption at education activity building (Universitas Pendidikan Indonesia as a case study);E Afiatun, S Wahyuni, N Gustria;IOP Conference Series: Earth and Environmental Science;245 (1), 012032;0;2019;#N/A;PflRiyi98mgC;xmJJ9Y0AAAAJ
695;Psychoeducation Dzikr Reduces Perceived Stress and Postpartum Depression Syndromes on Primiparous Women.;S Wahyuni, A Soejoenoes, ST Putra;Indian Journal of Public Health Research & Development;10 (3);0;2019;#N/A;vK1Ni-xiviEC;xmJJ9Y0AAAAJ
696;KULIAH KERJA NYATA REGULER UNIVERSITAS AHMAD DAHLAN PERIODE LXXI TAHUN AKADEMIK 2018/2019 DIVISI XIII. D. 1 Dusun Sumbertetes, Desa Patuk, Kecamatan Patuk;N Risky, R Hakim, S Wahyuni, T Nur, Y Tririnika, M Nur, G Rizki, W Widia;;;0;2019;#N/A;pf0VL3QzzAAC;xmJJ9Y0AAAAJ
697;IDENTIFIKASI KESALAHAN SISWA DALAM MENYELESAIKAN SOAL MATERI SISTEM PERTIDAKSAMAAN LINIER SATU VARIABEL DI KELAS VII SMP;SRI WAHYUNI;Universitas Muhammadiyah Palembang;;0;2019;#N/A;wxMeWMEqLDMC;xmJJ9Y0AAAAJ
698;STRONGLY GRADED RINGS WHICH ARE GENERALIZED DEDEKIND RINGS.;S Wahyuni, H Marubayashi, I Ernanto, Sutopo;Journal of Algebra and Its Applications;2050043;0;2019;#N/A;jKffii5DqX8C;xmJJ9Y0AAAAJ
699;13. Total Microbial Contamination Are Added To Meat Curry Leaf Extract (Murraya Koenigii) The Concentration And Old Storage Different;R Rastina, H Hanisah, R Rosmaidar, R Razali, S Wahyuni;Jurnal Medika Veterinaria;13 (1), 96-100;0;2019;#N/A;2oMuTuaXnloC;xmJJ9Y0AAAAJ
700;KULIAH KERJA NYATA UNIVERSITAS AHMAD DAHLAN PERIODE LXXI TAHUN AKADEMIK 2018/2019 DIVISI XVIII. C. 3 DUSUN JURANG, DESA BANJARHARJO, KECAMATAN KALIBAWANG, KABUPATEN KULONPROGO;B Boy, B Putri Nur MD, S Wahyuni, M Ayu Mulya Ningsih, N Auritha Biis, ...;;;0;2019;#N/A;_sH1KHQ1xKcC;xmJJ9Y0AAAAJ
701;PELATIHAN TERPADU (KEGEL dan CORE STABILITY) TERHADAP PENURUNAN TINGGI FUNDUS UTERI PADA IBU NIFAS DI RSU PKU MUHAMMADIYAH DELANGGU;S Wahyuni, A Wahyuningsih, W Widyawati;INVOLUSI Jurnal Ilmu Kebidanan (Journal of Midwifery Science);8 (16);0;2019;#N/A;vf0YIhSwahgC;xmJJ9Y0AAAAJ
702;The Strategy of Spiritual Leadership;J Jufrizen, M Sari, Mİ Nasutian, R Radiman, SF Wahyuni;International Journal of Research in Business and Social Science;(2147-4478 …;0;2019;#N/A;uoIO7Ko97q4C;xmJJ9Y0AAAAJ
703;PERAN MANAJEMEN DAKWAH DALAM KEGIATAN KEAGAMAAN PADA SEKSI BIMAS ISLAM DI KANTOR KEMENTRIAN AGAMA KABUPATEN GOWA;H HASARUDDIN, SRI WAHYUNI;Jurnal Dakwah Tabligh;19 (2), 277-290;0;2019;#N/A;V1pH50uuazEC;xmJJ9Y0AAAAJ
704;PENGARUH PERENDAMAN PADA BERBAGAI KONSENTRASI LARUTAN GIBERELIN (GA3) TERHADAP PERKECAMBAHAN BENIH PALEM MERAH (Cyrtostachys renda);R Fujianti, W Wijaya, S Wahyuni;Agroswagati Jurnal Agronomi;6 (2);0;2019;#N/A;QC_fukgq8lwC;xmJJ9Y0AAAAJ
705;Hubungan Indeks Massa Tubuh (IMT) dan Aktifitas Fisik dengan Derajat Nyeri Dismenorea Primer pada Siswi di SMA Muhammadiyah 1 Sragen;H Wulandari, S Wahyuni;Universitas Muhammadiyah Surakarta;;0;2019;#N/A;lAkp0ULYU5cC;xmJJ9Y0AAAAJ
706;Pengaruh Penggunaan Model Examples Non Examples Terhadap Prestasi Belajar Siswa Pada Materi Sistem Pencernaan ManusiaDi Kelas VIII SMP Negeri 2 Meureubo;S Wahyuni;Bionatural: Jurnal Ilmiah Pendidikan Biologi;3 (1);0;2019;#N/A;B-V0BYNYc0AC;xmJJ9Y0AAAAJ
707;PERANAN KELOMPOK TANI DALAM MENINGKATKAN PENDAPATAN USAHATANI PADI SAWAH ORGANIK (Oryza sativa L.) DI DESA LUBUK BAYAS KECAMATAN PERBAUNGAN;N Noviani, S Wahyuni;PROSIDING SEMINAR NASIONAL HASIL PENELITIAN;2 (1), 762-766;0;2019;#N/A;0tRseZjC4qsC;xmJJ9Y0AAAAJ
708;ISOLASI JAMUR ENDOFIT DAN UJI PENGHAMBATAN DENGAN JAMUR PATOGEN FUSARIUM OXYSPORUM SEBAGAI AGEN PENGENDALI HAYATI PADA TANAMAN KEDELAI SECARA INVITRO;S Wahyuni, N Noviani;PROSIDING SEMINAR NASIONAL HASIL PENELITIAN;2 (1), 712-719;0;2019;#N/A;YfTjWGZx48AC;xmJJ9Y0AAAAJ
709;PERAN PUSTAKAWAN SEBAGAI AGENT OF CHANGE DALAM MEMBERIKAN LAYANAN KEPADA PEMUSTAKA;SWS Wahyuni;LIBRIA;10 (2), 1-9;0;2019;#N/A;rMJ1_5uPwdAC;xmJJ9Y0AAAAJ
710;PENGARUH PROFESIONAL, PERTIMBANGAN PASAR KERJA, PERAN GENDER, LINGKUNGAN DAN KELUARGA DALAM PEMILIHAN KARIER AKUNTAN PUBLIK (Studi Empiris pada Mahasiswa Akuntansi di …;S Wahyuni, NS Askandar, MC Mawardi;Jurnal Riset Akuntansi;8 (04);0;2019;#N/A;MZHH0dlIDt0C;xmJJ9Y0AAAAJ
711;Unsur Intrinsik dalam Dongeng Bertrand Solet dan Michel Cosem dan Implikasinya terhadap Pembelajaran;S Wahyuni, S Sumarti, N Kusrini;Jurnal Pendidikan Bahasa Prancis;2 (1);0;2019;#N/A;oA8UEeFZdjYC;xmJJ9Y0AAAAJ
712;6. Identification and Distribution of Carbohydrates on Sex Accessories Glands of Male Aceh Cattle;M Jalaluddin, M Sabri, H Yuliani, FA Gani, H Hamny, S Wahyuni;Jurnal Medika Veterinaria;13 (1), 37-45;0;2019;#N/A;XfMaBeGYgSgC;xmJJ9Y0AAAAJ
713;Pembuatan Media Pembelajaran Inovatif Berbasis IPTEK bagi Guru SD Terpencil di Kecamatan Sabbangparu;Y Anita, R Karma, S Wahyuni, N Rahmi;Paradharma (Jurnal Aplikasi IPTEK);2 (2);0;2019;#N/A;QDEWnZBrHwAC;xmJJ9Y0AAAAJ
714;Faktor Ibu terhadap Kejadian Bayi Berat Lahir Rendah;AW Putri, A Pratitis, L Luthfiya, S Wahyuni, A Tarmali;HIGEIA (Journal of Public Health Research and Development);3 (1), 58-65;0;2019;#N/A;FP-YCU5gdjEC;xmJJ9Y0AAAAJ
715;Analisis Kinerja Keuangan di Nilai dari Rasio Likuiditas, Rasio Solvabilitas dan Rasio Profitabilitas pada PT Panambangan di Samarinda;S Wahyuni, R Samben, A Kusumawardani;Jurnal Ilmu Akuntansi Mulawarman (JIAM);3 (3);0;2019;#N/A;STWYWLtSq6gC;xmJJ9Y0AAAAJ
716;3. An Immunohistochemical Study of Alpha Estrogen Receptor (ERα) Development in Ovary and Uterus of Rat (Rattus norvegicus);S Wahyuni, C Desfariza, H Hamny, M Akmal, G Gholib, T Armansyah;Jurnal Medika Veterinaria;13 (1), 15-21;0;2019;#N/A;IjbvboqL_eAC;xmJJ9Y0AAAAJ
717;PENERAPAN PENDEKATAN SAINTIFIK DENGAN METODE DISKUSI KELOMPOK UNTUK MENINGKATKAN MOTIVASI DAN HASIL BELAJAR IPS MATERI MENGHARGAI PERJUANGAN PARA TOKOH DALAM MEMPERTAHANKAN …;SE Wahyuni;DINAMIKA;9 (1);0;2019;#N/A;RDd164uRGEsC;xmJJ9Y0AAAAJ
718;Pengaruh Kualitaa Produk dan Harga terhadap Loyalitas Pelanggan dalam Pembelian Produk Kosmetik Bedak Pixy (Studi Kasus pada Mahasiswa Fakultas Ekonomi dan Bisnis di …;S Wahyuni, PS Siburian, S Wahyuni;Jurnal Ilmu Manajemen Mulawarman (JIMM);3 (3);0;2019;#N/A;zI9YInTrFVIC;xmJJ9Y0AAAAJ
719;Pengaruh Personal Selling Dan Brand Image Serta Word Of Mouth Terhadap Keputusan Pembelian Mobil Toyota Kijang Innova Pada Auto 2000 Samarinda;R Aprinia, PS Siburian, S Wahyuni;Jurnal Ilmu Manajemen Mulawarman (JIMM);3 (4);0;2019;#N/A;bGIpCNGh66kC;xmJJ9Y0AAAAJ
720;Pengaruh ketidakpuasan konsumen dan iklan pesaing serta perilaku mencari variasi terhadap perilaku perpindahan merek;M Jannah, S Hudayah, S Wahyuni;Jurnal Ilmu Manajemen Mulawarman (JIMM);3 (4);0;2019;#N/A;ItgTnG0mAXQC;xmJJ9Y0AAAAJ
721;Pengaruh promosi penjualan dan karakteristik materialisme terhadap perilaku pembelian impuls via online di situs olx di samarinda;SA Saputra, R Rahmawati, S Wahyuni;Jurnal Ilmu Manajemen Mulawarman (JIMM);3 (3);0;2019;#N/A;IxBLoz_EsGYC;xmJJ9Y0AAAAJ
722;Pengaruh shopping lifestyle dan fashion involvement serta hedonic motives terhadap impluse buying behavior;YS Alim, S Suharno, S Wahyuni;Jurnal Ilmu Manajemen Mulawarman (JIMM);3 (3);0;2019;#N/A;Yeq4f8IuGg4C;xmJJ9Y0AAAAJ
723;Pengaruh kualitas customer relationship management dan kepuasan konsumen terhadap loyalitas nasabah bank;MF Djufri, S Hudayah, S Wahyuni;Jurnal Ilmu Manajemen Mulawarman (JIMM);3 (3);0;2019;#N/A;BtfE7wd9KvMC;xmJJ9Y0AAAAJ
724;Pengaruh experiential marketing dan percived quality serta advertising terhadap keputusan pembelian produk kosmetik wardah;A Ismi, J Kuleh, S Wahyuni;Jurnal Ilmu Manajemen Mulawarman (JIMM);3 (4);0;2019;#N/A;DPnopAH2kssC;xmJJ9Y0AAAAJ
725;Pengaruh pelayanan terhadap kepuasan pasien pada puskesmas desa juk ayak kabupaten kutai timur;N Sepriana, PS Siburian, S Wahyuni;Jurnal Ilmu Manajemen Mulawarman (JIMM);3 (4);0;2019;#N/A;uENYxwZKF5gC;xmJJ9Y0AAAAJ
726;Pengaruh persepsi nilai dan persepsi kualitas layanan serta citra perusahaan terhadap kepuasan konsumen;U Hariyanto, S Suharno, A Asnawati;Jurnal Ilmu Manajemen Mulawarman (JIMM);3 (3);0;2019;#N/A;3eo-xq64HD0C;xmJJ9Y0AAAAJ
727;Pengaruh citra dan persepsi konsumen serta pelayanan terhadap kepuasan nasabah tabungan;M Misrina, PS Siburian, S Wahyuni;Jurnal Ilmu Manajemen Mulawarman (JIMM);3 (3);0;2019;#N/A;6gD0efnhv6MC;xmJJ9Y0AAAAJ
728;Variabel anteseden purchase intention pelanggan hypermart;DM Aditama, T Hidayati, S Wahyuni;Jurnal Ilmu Manajemen Mulawarman (JIMM);3 (2);0;2019;#N/A;V0QqM0Py3VsC;xmJJ9Y0AAAAJ
729;Pengaruh Kualitas Layanan dan Harga terhadap Loyalitas Pelanggan Rumah Makan Prambanan di Samarinda;W Amat, S Suharno, S Wahyuni;Jurnal Ilmu Manajemen Mulawarman (JIMM);3 (2);0;2019;#N/A;tVg3zZbtnc0C;xmJJ9Y0AAAAJ
730;Pengaruh Nilai Pelanggan dan Word of Mouth Terhadap Keputusan Pembelian (Pada Konsumen Mc Donalds Samarinda Central Plaza);AW Putra, T Hidayati, S Wahyuni;Jurnal Ilmu Manajemen Mulawarman (JIMM);3 (2);0;2019;#N/A;7-gQGTwtAzQC;xmJJ9Y0AAAAJ
731;PERAN INTELLECTUAL CAPITAL DALAM PENGEMBANGAN JARINGAN KERJA SAMA TAMAN BACAAN MASYARAKAT: STUDI KASUS TAMAN BACAAN CAKRUK PINTAR YOGYAKARTA;S Wahyuni, J Jumino;Jurnal Ilmu Perpustakaan;6 (2), 171-180;0;2019;#N/A;pGq6TLPqxssC;xmJJ9Y0AAAAJ
732;Pengaruh persepsi harga dan diferensiasi produk terhadap loyalitas konsumen;I Irma, PS Siburian, S Wahyuni;Jurnal Ilmu Manajemen Mulawarman (JIMM);3 (1);0;2019;#N/A;prKdS1S5QkMC;xmJJ9Y0AAAAJ
733;Efektivitas Kegiatan Mentoring Al Islam dan Kemuhammadiyahan dalam Meningkatkan Pemahaman Materi Ubudiah Pada Mahasiswa Program Studi Pendidikan Pancasila dan Kewarganegaraan …;S Wahyuni, YB Setyadi;Universitas Muhammadiyah Surakarta;;0;2019;#N/A;zeZllD8TmcoC;xmJJ9Y0AAAAJ
734;PEMANFAATAN JERAMI SEBAGAI BAHAN BAKU PEMBUATAN PUPUK ORGANIK DI DESA PEMATANG JOHAR KECAMATAN LABUHAN DELI KABUPATEN DELI SERDANG;S Wahyuni, F Yani;PROSIDING SEMINAR NASIONAL HASIL PENGABDIAN;2 (1), 573-576;0;2019;#N/A;jh7fJAhS9AIC;xmJJ9Y0AAAAJ
735;Analisis faktor-faktor yang mempengaruhi keputusan nasabah memilih transaksi gadai emas;SH Tika, S Mintarti, S Wahyuni;Jurnal Ilmu Ekonomi Mulawarman (JIEM);3 (3);0;2019;#N/A;4ZjPyBmb-CUC;xmJJ9Y0AAAAJ
736;PEMANFAATAN KULIT IKAN NILA MENJADI PRODUK OLAHAN KERUPUK DI DESA PEMATANG JOHAR KECAMATAN LABUHAN DELI KABUPATEN DELI SERDANG;N Noviani, S Wahyuni;PROSIDING SEMINAR NASIONAL HASIL PENGABDIAN;2 (1), 522-525;0;2019;#N/A;Xs1h1I_UytMC;xmJJ9Y0AAAAJ
737;The Chemistry Competency Achievement of SMA Negeri 7 Palu Students Using Predict, Observe, and Explain (POE) Learning Model;I Ijirana, S Wahyuni;Indonesian Journal on Learning and Advanced Education (IJOLAE);1 (1);0;2019;#N/A;7DTIKO_nxaIC;xmJJ9Y0AAAAJ
738;GAMBARAN PELAKSANAAN FUNGSI PERAWATAN KELUARGA PADA ANGGOTA KELUARGA YANG MENDERITA TB PARU DIPUSKESMAS;F Fahruddin, D Karim, S Wahyuni;Jurnal Online Mahasiswa (JOM) Bidang Ilmu Keperawatan;6 (1), 36-45;0;2019;#N/A;NYu48kWxaQAC;xmJJ9Y0AAAAJ
739;Dinamika Perubahan Kurikulum Madrasah Diniyah Pondok Pesantren Putri Lirboyo Al-Mahrusiyah Kediri;M Rhoyachin, S Wahyuni;Jurnal Pemikiran Keislaman;30 (1), 130-147;0;2019;#N/A;EvHYAMKeY9cC;xmJJ9Y0AAAAJ
740;Peer Correction On Writing Quality Of College Students Having Different Cognitive Styles;S Wahyuni;INFERENSI: Jurnal Penelitian Sosial Keagamaan;12 (2), 259-282;0;2019;#N/A;cUWptXWc3MAC;xmJJ9Y0AAAAJ
741;Hubungan Asupan Lemak dan Zat Besi dengan Kejadian Anemia Saat Menstruasi Pada Mahasiswa Di Asrama Kebidanan UNW Ungaran;S Wahyuni, SAKMA Sari, DK Rahmawati;Pro Health Jurnal Ilmiah Kesehatan;1 (1);0;2019;#N/A;AU_EAA-G7qsC;xmJJ9Y0AAAAJ
742;HASIL BELAJAR SISWA BERDASARKAN INTENSITAS KEGIATAN BRAIN GYM PADA PEMBELAJARAN MATEMATIKA;W Agustina, S Wahyuni;JP;P2M (Jurnal Pendidikan dan Pembelajaran Matematika) 4 (2), 93-99;0;2019;#N/A;Q53-OCnB6AQC;xmJJ9Y0AAAAJ
743;STRATEGI PEMASARAN PRODUK SAYURAN DATARAN TINGGI DI WILAYAH KECAMATAN BATUR KABUPATEN BANJARNEGARA;P Pujiharto, S Wahyuni;Agritech: Jurnal Fakultas Pertanian Universitas Muhammadiyah Purwokerto;20 …;0;2019;#N/A;1UYbAEPjJNAC;xmJJ9Y0AAAAJ
744;IMPLEMENTASI PENDEKATAN SAINSTIFIK PADA PELAJARAN BIOLOGI UNTUK MENINGKATKAN HASIL BELAJAR KOGNITIF DAN KETERAMPILAN SAINS SISWA KELAS XI-IPA SMA NEGERI 2 LAMBANDIA, KAB …;S Wahyuni;Jurnal Pendidikan Biologi;9 (2), 47-55;0;2019;#N/A;TCy96lt6RIkC;xmJJ9Y0AAAAJ
745;Perencanaan Sumur Resapan di Kawasan Perumahan Puri Bunga Nirwana, Perumahan Bukit Permai, dan Perumahan Gunung Batu;S Wahyuni, G Halik, WS Wulandari;Jurnal Rekayasa Sipil dan Lingkungan;2 (02), 119-130;0;2019;#N/A;HM9HXerLlEkC;xmJJ9Y0AAAAJ
746;FAKTOR-FAKTOR YANG BERHUBUNGAN DENGAN EFIKASI DIRI PASIEN PASCA STROKE: STUDI CROSS SECTIONAL DI RSUD GAMBIRAN KEDIRI;S Wahyuni, C Dewi;Jurnal Wiyata Penelitian Sains dan Kesehatan;5 (2), 85-92;0;2019;#N/A;0wD49__q8KEC;xmJJ9Y0AAAAJ
747;UJI DAYA HAMBAT BEBERAPA EKSTRAK BAHAN ALAMI TERHADAP PERTUMBUHAN CENDAWAN Pyricularia grisea (INHIBITORY POTENTIAL EFFECT OF DIFFERENT PLANT EXTRACTS ON THE GROWTH OF …;Z Zuraidah, S Wahyuni;Prosiding Biotik;5 (1);0;2019;#N/A;END1nS_e-6cC;xmJJ9Y0AAAAJ
748;Pengaruh Pembelajaran Sekolah Lima Hari, Kemandirian Belajar terhadap Prestasi Belajar Siswa XII Pemasaran SMK Negeri 1 Surakarta Ajaran 2018/2019;PP Ningrum, S Wahyuni, SA Totalia;Jurnal Pendidikan Bisnis dan Ekonomi;4 (2);0;2019;#N/A;U5I91ptAnUUC;xmJJ9Y0AAAAJ
749;Strategi Pendidikan Unggul Berbasis Organisasi di Pimpinan Daerah Ikatan Pelajar Muhammadiyah Ponorogo;S Wahyuni, N Nuraini, N Abidin;Istawa: Jurnal Pendidikan Islam;3 (2), 97-110;0;2019;#N/A;tVbZQR0Ku0MC;xmJJ9Y0AAAAJ
750;PENGARUH PROSES MODIFIKASI TERHADAP KARAKTERISTIK TEPUNG KELADI TERMODIFIKASI;D Ashari, S Wahyuni, RHF Faradilla;Jurnal Sains dan Teknologi Pangan;3 (6);0;2019;#N/A;w1G5vK4DiEkC;xmJJ9Y0AAAAJ
751;Pengembangan strategi bersaing dalam meningkatkan mutu layanan klaim;S Wahyuni;Jurnal Riset Perbankan Manajemen dan Akuntansi;3 (1), 1-14;0;2019;#N/A;utCHnwRdBgEC;xmJJ9Y0AAAAJ
752;Upaya Peningkatan Perkembangan Kecakapan Hidup Sosial dan Pencegahan Kekerasan Seksual pada Anak Usia 4-6 Tahun di TK Pelangi Wilayah Kerja Puskesmas Sunyaragi Kota Cirebon;S Wahyuni, B Badriah;Edukasi Masyarakat Sehat Sejahtera (EMaSS): Jurnal Pengabdian Kepada …;;0;2019;#N/A;IEPzPICaOQQC;xmJJ9Y0AAAAJ
753;BUDAYA ASAL DALAM ORIENTASI LAHAN HUNIAN TRANSMIGRAN BALI DIDESA JATIBALI KABUPATEN KONAWE SELATAN;S Wahyuni, H Husmawaty;Seminar Nasional Teknologi Terapan Berbasis Kearifan Lokal;1 (1);0;2019;#N/A;LNbnizmRdgkC;xmJJ9Y0AAAAJ
754;Determination of Digital Marketing Strategies As Effective Communication Techniques For GoOntravel Brand Awareness;Z Samran, S Wahyuni, M Misril, R Nabila, A Putri;Journal of Research in Marketing;9 (3), 752-757;0;2019;#N/A;h-OLoDDdPfcC;xmJJ9Y0AAAAJ
755;ANALISIS PENGARUH KUALITAS PRODUK, WORD OF MOUTH, DAN HARGA TERHADAP KEPUTUSAN PEMBELIAN SMARTPHONE XIAOMI (Studi Kasus Mahasiswa FEBI IAIN Purwokerto);SRI WAHYUNI;IAIN Purwokerto;;0;2019;#N/A;gyFZhc6YOh8C;xmJJ9Y0AAAAJ
756;A Sequential Explanatory Investigation of TPACK: Indonesian Science Teachers' Survey and Perspective.;M Muhaimin, A Habibi, A Mukminin, F Saudagar, R Pratama, S Wahyuni, ...;Journal of Technology and Science Education;9 (3), 269-281;0;2019;#N/A;T4xR6ACgc60C;xmJJ9Y0AAAAJ
757;The strategy of Spiritual Leadership: The Role of Spiritual Survival, Workplace Spirituality and Organizational Commitment at Private Universities;M Sari, MI Nasution, SF Wahyuni;International Journal of Research in Business and Social Science;8 (1), 64-72;0;2019;#N/A;2hxEYnSErgUC;xmJJ9Y0AAAAJ
758;TEKNIK SMOCK SISIK PADA PEMBUATAN BUSANA PESTA DENGAN KOMBINASI KAIN TENUN TORAJA;S WAHYUNI;FT;;0;2019;#N/A;yREA-gn6pYwC;xmJJ9Y0AAAAJ
759;Pengaruh Latihan Dosis Submaksimal Otot Triceps Brachii Terhadap Kekuatan Pukulan Oi Zuki Atlet Karate Universitas Muhammadiyah Surakarta;I Iskandarsyah, S Wahyuni, S KM, SST Sugiono;Universitas Muhammadiyah Surakarta;;0;2019;#N/A;1vh4mnD7xAIC;xmJJ9Y0AAAAJ
760;Pengaruh Penambahan Kinesio Tapping Pada Terapi Core Stability Exercise Terhadap Penurunan Nyeri Punggung Bawah Petugas Cleaning Service di Universitas Muhammadiyah Surakarta;ST Aji, SKM Wahyuni;Universitas Muhammadiyah Surakarta;;0;2019;#N/A;K0fIQ6b0NmsC;xmJJ9Y0AAAAJ
761;The influence of product innovation, brand image, and physical evidence to purchase decision and WOM of Starbucks in Jakarta;S Wahyuni;Middle East Journal of Management;6 (2), 123-138;0;2019;#N/A;uhm167Bumv8C;xmJJ9Y0AAAAJ
762;Efektivitas Keterampilan Mengajar Guru Kompetensi Keahlian Administrasi Perkantoran di SMK Negeri 4 Makassar;S Wahyuni, S Saleh, M Darwis;UNIVERSITAS NEGERI MAKASSAR;;0;2019;#N/A;tYdqGa2HnWcC;xmJJ9Y0AAAAJ
763;EFEKTIVITAS BIOKOMPOS DAN MIKROBA KONSORSIA PENDEGRADASI RESIDU INSEKTISIDA KLORPIRIFOS PADA PERTANAMAN BAWANG MERAH (Allium ascalonicum L.;WD WULANSARI, K Karno, S Wahyuni;Faculty of Animal and Agricultural Sciences;;0;2019;#N/A;66S1BDY1aroC;xmJJ9Y0AAAAJ
764;PENGARUH PENDEKATAN PEMBELAJARAN TERHADAP NILAI PENGETAHUAN DAN KETERAMPILAN SEJARAH INDONESIA (Eksperimen pada Siswa SMA Swasta di Jakarta Timur);S Wahyuni;RESEARCH AND DEVELOPMENT JOURNAL OF EDUCATION;4 (2);0;2018;#N/A;M9BB6krhjY8C;xmJJ9Y0AAAAJ
765;PLACEMAKING SEBAGAI STRATEGI REVITALISASI KAWASAN Studi Kasus: Kawasan Pecinan Kota Makassar;S Wahyuni;LINEARS: Jurnal Teknik Arsitektur;1 (2), 103-111;0;2018;#N/A;moWhu9_CcosC;xmJJ9Y0AAAAJ
766;ANALISIS NARATIF BERITA KONFLIK KPK DAN POLRI DI MEDIA INDONESIA ONLINE (Narrative Analysis concerning Conflict News between Corruption Eradication Commission (KPK) and …;S Wahyuni;SAWERIGADING;24 (2), 143-155;0;2018;#N/A;BhdUJeZOhtEC;xmJJ9Y0AAAAJ
767;PENGARUH SISTEM PENGUKURAN KINERJA DAN SISTEM PENGHARGAAN TERHADAP KEEFEKTIFAN PENERAPAN TEKNIK TOTAL QUALITY MANAGEMENT (TQM) PADA KANTOR POS PUSAT DI PEKAN BARU;Y Yusriwarti, S Wahyuni;Jurnal Akuntansi dan Keuangan;7 (2), 45-59;0;2018;#N/A;6daZS1cS2l8C;xmJJ9Y0AAAAJ
768;Proses Belajar Masyarakat secara Informal dalam Pengembangan Usaha Jasa Sepeda Onthel;MF Rozi, S Wahyuni, S Sopingi;Journal of Nonformal Education and Community Empowerment;2 (2);0;2018;#N/A;Z1-ZXlhpk50C;xmJJ9Y0AAAAJ
769;Mobile Partograf: Aplikasi Untuk Memantau Kemajuan Persalinan;S Wahyuni, R Nuryuniarti, E Nurmahmudah;Jurnal Riset Kebidanan Indonesia;2 (2), 75-80;0;2018;#N/A;Hf1drVALF3gC;xmJJ9Y0AAAAJ
770;Analisis Penggunaan Metode Zmijewski dalam Memprediksi Financial Distress pada Perusahaan Manufaktur Sektor Industri Semen;S Wahyuni, Z Arifin;Universitas Muhammadiyah Kalimantan Timur;;0;2018;#N/A;6XuKD3u7GOoC;xmJJ9Y0AAAAJ
771;GAMBARAN KEJADIAN RUPTURE PERINEUM PADA PERSALINAN NORMAL DI PUSKESMAS JUMPANDANGBARUTAHUN 2017;S Wahyuni, H Hardayanti;Media Bidan;3 (2), 87-93;0;2018;#N/A;VsjxJ5V0Y48C;xmJJ9Y0AAAAJ
772;KAJIAN KUALITAS BAKSO NABATI FORMULASI JAMUR TIRAM (Pleurotus ostreatus) DENGAN PENAMBAHAN DAUN BAYAM (Amaranthus) DAN TEPUNG WIKAU MAOMBO SEBAGAI PRODUK PANGAN FUGSIONAL;S Ahmad, S Wahyuni;Jurnal Sains dan Teknologi Pangan;3 (5);0;2018;#N/A;vfT5ieZw1WcC;xmJJ9Y0AAAAJ
773;PENGARUH FORMULASI TEMULAWAK (Curcuma Xanthorrhiza) PADA CAMPURAN TEH CELUP TAWAOLOHO (Spondias Pinnata) DAN TEH MELATI (Jasminum Officinale) TERHADAP MUTU PRODUK TEH CELUP;SR Dewi, S Wahyuni;Jurnal Sains dan Teknologi Pangan;3 (5);0;2018;#N/A;CiMAqHksD8sC;xmJJ9Y0AAAAJ
774;KARAKTERISASI SIFAT FISIK PRODUK MIE BASAH DARI TEPUNG OPA (Dioscorea esculenta L.) TERMODIFIKASI DENGAN PENAMBAHAN BUBUR RUMPUT LAUT;R St Rahmi, S Wahyuni;Jurnal Sains dan Teknologi Pangan;3 (5);0;2018;#N/A;OmvXvaxYObgC;xmJJ9Y0AAAAJ
775;Efektivitas Penerapan Model Attention, Relevance, Confidence, Statisfaction (ARCS) Berbantuan Video Tutorial Untuk Meningkatkan Keaktifan Dan Motivasi Belajar Peserta Didik Di …;JA Nugroho, S Wahyuni;BISE: Jurnal Pendidikan Bisnis dan Ekonomi;4 (2), 41-51;0;2018;#N/A;ix4AEQmNN7wC;xmJJ9Y0AAAAJ
776;ANALISIS DETERMINAN YANG MEMPENGARUHI KEJADIAN PERDARAHAN POSTPARTUM;S Wahyuni, E Surani;SMART Jurnal Kebidanan;5 (2), 1-10;0;2018;#N/A;jmwITWCuk8IC;xmJJ9Y0AAAAJ
777;Pengaruh Blended Learning Model dan Sikap Berbahasa terhadap Kemampuan Menulis Bahasa Inggris Siswa Sekolah Menegah Atas Negeri di Kota Pekanbaru;S Wahyuni, F Etfita;GERAM;6 (2), 1-9;0;2018;#N/A;VoowTMkWmDwC;xmJJ9Y0AAAAJ
778;FAKTOR-FAKTOR YANG MEMPENGARUHI KEJADIAN HIPEREMESIS GRAVIDARUM (Studi Kasus di Rumah Sakit Umum Daerah dr Zainoel Abidin Banda Aceh);N Yusuf, S Wahyuni;Majalah Kesehatan Masyarakat Aceh (MaKMA);1 (2), 94-100;0;2018;#N/A;YZzzgH80nR8C;xmJJ9Y0AAAAJ
779;PENGARUH PEMBELAJARAN ETNOMATEMATIKA PADA CANDI CETHO TERHADAP KEMAMPUAN BERPIKIR KRITIS;S Wahyuni, A Trisiana;JURNAL SINEKTIK;1 (2), 191-207;0;2018;#N/A;L1d--jQnBlAC;xmJJ9Y0AAAAJ
780;ANALISIS KEMAMPUAN BERPIKIR TINGKAT TINGGI (HIGH ORDER THINKING SKILLS) MENGGUNAKAN INSTRUMEN TWO TIER MULTIPLE CHOICE MATERI KONSEP DAN FENOMENA KUANTUM SISWA SMA DI KABUPATEN …;G Ramadhan, P Dwijananti, S Wahyuni;UPEJ Unnes Physics Education Journal;7 (3), 85-90;0;2018;#N/A;94js0qVkt3AC;xmJJ9Y0AAAAJ
781;Pengaruh Beasiswa Bidikmisi dan Kemandirian Belajar terhadap Prestasi Belajar Mahasiswa Bidikmisi Tahun Angkatan 2014 Fakultas Keguruan dan Ilmu Pendidikan Universitas Sebelas …;ZN Afida, S Wahyuni, SA Totalia;Jurnal Pendidikan Bisnis dan Ekonomi;4 (2);0;2018;#N/A;0IGl3jR3yJEC;xmJJ9Y0AAAAJ
782;Identifikasi preparat gosok tulang femur ayam (Gallus gallus) dengan pewarnaan alami bunga telang (Clitoria ternatea L.);S Wahyuni, VR Tosiyana;Prosiding Seminar Nasional Pendidikan Biologi;;0;2018;#N/A;Kp2F6cy7E28C;xmJJ9Y0AAAAJ
783;PENGARUH MULTIMEDIA INTERAKTIF TERHADAP HASIL BELAJAR SISWA KELAS XII PROGRAM KEAHLIAN AKUNTANSI PADA MATERI ENTRI JURNAL KHUSUS DI SMK LABOR BINAAN FKIP UNRI PEKANBARU;S Wahyuni, G Gimin, H Hendripides;Jurnal Online Mahasiswa (JOM) Bidang Keguruan dan Ilmu Pendidikan;5 (2), 503-515;0;2018;#N/A;P3HMU8IszGwC;xmJJ9Y0AAAAJ
784;PENGARUH BINGO GAME TERHADAP KEMAMPUAN MEMBACA PERMULAAN ANAK USIA 4-5 TAHUN DI TK ISLAM FATIMAH KECAMATAN TAMPAN KOTA PEKANBARU;S Wahyuni, D Risma, R Kurnia;Jurnal Online Mahasiswa (JOM) Bidang Keguruan dan Ilmu Pendidikan;5 (2), 688-701;0;2018;#N/A;gJGMWE3-404C;xmJJ9Y0AAAAJ
785;Persepsi Mahasiswa tentang Gaya Mengajar Dosen dan Fasilitas Belajar Terhadap Motivasi Belajar Mahasiswa Program Sudi Pendidikan Ekonomi STKIP PGRI Sumatera Barat;S Wahyuni;Jurnal Inovasi Pendidikan Ekonomi;8 (2), 113-121;0;2018;#N/A;TcjEerm5wdgC;xmJJ9Y0AAAAJ
